Name,Phone_1,Phone_2,Email,Location,Area,Governorate,Country,About,Website,URL,Facebook,Instagram,LinkedIn,Twitter
Young Kids Sport Club,+966 542240251,+966 112100005,,"Al Mrooj Dist., Riyadh, Al Mrooj Dist., Riyadh, Riyadh Province, Saudi Arabia",Al Mrooj Dist.,Riyadh Province,Saudi Arabia,Young Kids Sport Club,,https://arablocal.com/business/view/young-kids-sport-club,,,,
Red Fish Park Madinah Al Madinah Al Munawarah,+966 505133225,+966 148272902,,"Jeddah Highway, Madinah, Al Madinah Al Munawarah, Madinah, Al Madinah Al Munawarah, Madinah Province, Saudi Arabia",Jeddah Highway,Madinah Province,Saudi Arabia,Red Fish Park Madinah Al Madinah Al Munawarah,,https://arablocal.com/business/view/red-fish-park-madinah-al-madinah-al-munawarah,,,,
Fanateer International Recreation Co. Al Madinah Al Munawarah,+966 128641182,,,"King Abdul Aziz Turnabout, Second Ring, Al Madinah Al Munawarah, Second Ring, Al Madinah Al Munawarah, Madinah Province, Saudi Arabia",King Abdul Aziz Turnabout,Madinah Province,Saudi Arabia,Fanateer International Recreation Co. Al Madinah Al Munawarah,,https://arablocal.com/business/view/fanateer-international-recreation-co-al-madinah-al-munawarah,,,,
Red Fish Park Aziziyah Al Madinah Al Munawarah,+966 148302454,,,"Aziziyah Dist., Al Madinah Al Munawarah, Aziziyah Dist., Al Madinah Al Munawarah, Madinah Province, Saudi Arabia",Aziziyah Dist.,Madinah Province,Saudi Arabia,Red Fish Park Aziziyah Al Madinah Al Munawarah,,https://arablocal.com/business/view/red-fish-park-aziziyah-al-madinah-al-munawarah,,,,
Red Fish Park Qubah Al Madinah Al Munawarah,+966 148699011,,,"Qubah, Al Madinah Al Munawarah, Qubah, Al Madinah Al Munawarah, Madinah Province, Saudi Arabia",Qubah,Madinah Province,Saudi Arabia,Red Fish Park Qubah Al Madinah Al Munawarah,,https://arablocal.com/business/view/red-fish-park-qubah-al-madinah-al-munawarah,,,,
Hi kids Tahliah Street Riyadh,,,info@hikids.com.sa,"Localizer Mall, Tahliah Street, Riyadh, Tahliah Street, Riyadh, Riyadh Province, Saudi Arabia",Localizer Mall,Riyadh Province,Saudi Arabia,Hi kids Tahliah Street Riyadh,http://hikids.com.sa/arabic/,https://arablocal.com/business/view/hi-kids-tahliah-street-riyadh,https://www.facebook.com/hikids.candy,https://www.instagram.com/hikids_ksa/?hl=en,,https://twitter.com/hikids_ksa
Tokyo Games Ali Reza Holding Co. Sharafiyah Jeddah,+966 126504000,,orders@tokyogames.com,"Ali Reza Building, Madina Descending Road, Sharafiyah Dist., Jeddah, Sharafiyah Dist., Jeddah, Makkah Province, Saudi Arabia",Ali Reza Building,Makkah Province,Saudi Arabia,Tokyo Games Ali Reza Holding Co. Sharafiyah Jeddah,http://www.tokyogames.com/en/,https://arablocal.com/business/view/tokyo-games-ali-reza-holding-co-sharafiyah-jeddah,,,,
Tokyo Games Ali Reza Holding Co. Al Baghdadiyah Jeddah,+966 126504000,,orders@tokyogames.com,"Madinah Descending Rd., Al Baghdadiyah Dist., Jeddah, Al Baghdadiyah Dist., Jeddah, Makkah Province, Saudi Arabia",Madinah Descending Rd.,Makkah Province,Saudi Arabia,Tokyo Games Ali Reza Holding Co. Al Baghdadiyah Jeddah,http://www.tokyogames.com/en/,https://arablocal.com/business/view/tokyo-games-ali-reza-holding-co-al-baghdadiyah-jeddah,,,,
Bayzat,+966 112073638,,talktous@bayzat.com,"Laysen Valley, Building No. 13, Ground Floor Office No. 1 Intersection King Khaled & Orouba Road, Riyadh Area, Riyadh, Riyadh Province, Saudi Arabia",Laysen Valley,Riyadh Province,Saudi Arabia,"Bayzat is changing the way work works for the better.We’ve built innovative HR, payroll and insurance technology, and created a world-class employee experience that benefits everyone.By making it accessible to all employers, we’ll take businesses to the next level and open up entire new possibilities in work life.Our HR tech allows you to save time on HR processes such as leave management, employee record upkeep, tracking attendance and managing shift schedules for your employees.Our payroll ...",http://www.bayzat.com/ar/ksa/,https://arablocal.com/business/view/bayzat,https://www.facebook.com/bayzatme,https://www.instagram.com/bayzatme/,https://www.linkedin.com/company/bayzat/,https://twitter.com/bayzatme
