Name,Email,Location,Area,Governorate,Country,About,Website,Views,Fax,URL,Facebook,Instagram,Phone,Twitter
Blue Sea Metal Scrap Trading LLC Sharjah,,"Ground Floor, Al Dhaid Road,",Saja'a Industrial,Sharjah,UAE,Blue Sea Metal Scrap Trading LLC Sharjah,http://www.blueseametal.com/,2294,,https://uae.arablocal.com/business/view/blue-sea-metal-scrap-trading-llc-sharjah,,,+971 65310629 65310641,
Professional Laundry Equipment Trading PLET Al rashidiya Dubai,,"Professional Laundry Building, Street # 32-A, Umm Ramool,",Al Rashidiya,Dubai,UAE,Professional Laundry Equipment Trading PLET Al rashidiya Dubai,http://alhathboor.com/,2229,,https://uae.arablocal.com/business/view/professional-laundry-equipment-trading-plet-al-rashidiya-dubai,,,+971 46085578; +971 504503667 42821922,
Ibn Al Haj Chemicals,,"Plot # TP 040316,",Dubai World Central,Dubai,UAE,Ibn Al Haj Chemicals,http://www.iahchemicals.com/,2154,,https://uae.arablocal.com/business/view/ibn-al-haj-chemicals,,,+971 43426464 43358227,
Al Mawsim Tents Industries LLC,,"Ground Floor, Al Mawasim Tents Building, Office # 1, Al Ittihad Road,",Industrial Area # 7,Sharjah,UAE,Al Mawsim Tents Industries LLC,http://www.almawsimtents.com/,1983,,https://uae.arablocal.com/business/view/al-mawsim-tents-industries-llc,,,+971 65319983 65319984,
Al Sindbad Insulation Materials and Al Reem Building Materials,,"Sindbad group building,",Saja'a Industrial,Sharjah,UAE,Al Sindbad Insulation Materials and Al Reem Building Materials,http://www.alsindbadgroup.com/,1810,,https://uae.arablocal.com/business/view/al-sindbad-insulation-materials-and-al-reem-building-materials,,,+971 65345994 65345997,
Campro Technical Services LLC,,Box No. 31920,Dubai Silicon Oasis,Dubai,UAE,"CAMPRO TECHNICAL SERVICES LLC is located in Dubai, UAE. Company is working in Metal Products, Contractors business activities.",http://www.carcility.com/,1792,,https://uae.arablocal.com/business/view/campro-technical-services-llc,,,+971 42678731 42678732,
Teka Kuchentechnik UAE LLC Al Garhoud Dubai,,"Mezzanine Floor, Bin Khadia Building, Office # M3, Sheikh Rashid Road,",Al Garhoud,Dubai,UAE,Teka Kuchentechnik UAE LLC Al Garhoud Dubai,http://teka.com/pl-pl/,1627,,https://uae.arablocal.com/business/view/teka-kuchentechnik-uae-llc-al-garhoud-dubai,,,+971 42833047 42833048,
Car Parking Shades Suppliers,maqavisuhatents@gmail.com,2b Street al quoz,Al Quoz Industrial Area 3,Dubai,UAE,"CAR PARKING SHADED SUPPLIERS IN JUMAIRAH PARK 0543839003 Car Park Shades, Tents, Dubai Wedding Tents, Shades and Tents, Tents And Shades, Parking Shades Dubai, Rental Tents, Canopies, Awnings Suppliers, Patio Awnings, Garden Shades, Tensile Shades. https://youtu.be/txv2IGlDUDo Best and High Quality Suppliers Car park Shades, Our Products are. Car Park Sheds, Tents, Awnings, Canopies, Tensile Fabric Shades, Pergola, Sail Shades, Garden Sun Shades, Swimming Pool Shades, Playground shades, Tents...",https://posts.gle/pFWBT,1621,054382900,https://uae.arablocal.com/business/view/car-parking-shades-suppliers,https://www.facebook.com/alduhatents,https://www.instagram.com/tentsandshades,+971 543839003; +971505773027; +971543839003,https://twitter.com/maqavutents
Fashion Studio Llc,,Box No. 28091,Dubai Others,Dubai,UAE,"FASHION STUDIO LLC is located in Dubai, UAE. Company is working in Beauty Products, Cosmetics, Clothing and Accessories, Gifts, Jewellery, Imitation Jewellery, Textile, Handbags & Leather Products business activities. Visit our company website for more information about us : http://www.sharafretail.com",http://www.sharafretail.com,1609,,https://uae.arablocal.com/business/view/fashion-studio--llc,,,+971 2821515 2820818,
Jabouri Establishment - Heavy Equipment Spare Parts Trading,info@jabouri.ae,"Sharjah Industrial Area 10, Third Industrial St - United Arab Emirates",Industrial Area 10,Sharjah,UAE,Jabouri Establishment specializes in aftermarket spare parts trading for most common heavy machinery industries in the Middle East. 30 Days Return Policy - Comprehensive Warranty - Supportive Prices - Guaranteed Quality - 24/7 Whatsapp Inquiry Service,http://www.jabouri.ae,1576,,https://uae.arablocal.com/business/view/jabouri-establishment--heavy-equipment-spare-parts-trading,,,+971 502552713; +971 67674770; +971 549994371,
