Name,Phone_1,Phone_2,Phone_3,WhatsApp,Email,Location,Governorate,Country,About,Website,URL,Facebook,Instagram,LinkedIn,Twitter,YouTube
Cranskuwait Pest Control Services,+96597723707,,,,,"Ali Tower qibla Abdullah Mubarak Street,Mirqab",Capital Governorate,Kuwait,Cranskuwait Pest Control Services located in kuwait,https://cranskuwait.com,https://kuwaitlocal.com/business/cranskuwait-pest-control-services,,,,,
Fresh Island General Trading Co,+96522421170,,,,,"Fresh Island General Trading Company, Office 9, 17th Floor, Al Adala Tower, Building-15, Near Majid Round About,Mirqab",Capital Governorate,Kuwait,We are an Agro based Export import company who wish to Excel in providing our customers with an exceptional quality produce at a competitive pricing.,https://www.freshislandcompany.com,https://kuwaitlocal.com/business/fresh-island-general-trading-co-,,,,,
Go Fresh,+96594130211,,,,,Shuwaikh,Capital Governorate,Kuwait,"Go Fresh is based in Kuwait — An open market to fruits and vegetables. We have a team of highly experienced inspectors in Kuwait and the region who are constantly looking for new sources and opportunities. In fact, our mission is to inspect and fined the quality aimed for more than purchasing goods. In other words, we have more eyes and ears at the field and farm levels.Quality is the target in every aspect of the business. Growers and exporters frequently ask to ship their produce from all o...",https://www.gofreshkwt.com,https://kuwaitlocal.com/business/go-fresh,,https://instagram.com/gofresh.kwt?igshid=1oj8fhh4zpwz6,,,
Edible Arrangements Salmiya,,,,,,,Hawalli Governorate,Kuwait,Edible Arrangements Salmiya,https://www.ediblearrangements.com/?utm_source=kwredirect/,https://kuwaitlocal.com/business/edible-arrangements-salmiya,https://www.facebook.com/ediblearrangements,https://instagram.com/accounts/login/?next=/ediblearrangements/,,https://twitter.com/edible,https://www.youtube.com/ediblearrangements
Edible Arrangements Sharq,,,,,,,Capital Governorate,Kuwait,Edible Arrangements Sharq,https://www.ediblearrangements.com/?utm_source=kwredirect/,https://kuwaitlocal.com/business/edible-arrangements-sharq,https://www.facebook.com/ediblearrangements,https://instagram.com/accounts/login/?next=/ediblearrangements/,,https://twitter.com/edible,https://www.youtube.com/ediblearrangements
Gulf Agro Fish Fertilizer,+96567733900,,,,,Kuwait City,Capital Governorate,Kuwait,Gulf Company for Organic and Biological Fertilizers.,https://www.gulfagro.net,https://kuwaitlocal.com/business/gulf-agro-fish-fertiizer,,https://www.instagram.com/gulf_agro/,,,
Nebosh Oil and Gas,+96567097786,+96566040331,,+96567097786,,"Block: Grand Hyper, Street: 2nd floor, office number 10,Fahaheel",Al-Ahmadi Governorate,Kuwait,"Employees can contribute to workplace safety by following safety protocols, reporting hazards promptly, and actively participating in safety training and initiatives.Enroll in NEBOSH IGC training with NCB to obtain certification and enhance employability on a global scale. NEBOSH Oil and Gas",https://wa.me/96567097786,https://kuwaitlocal.com/business/nebosh-oil-and-gas,,https://www.instagram.com/ncb_997/?hl=en,https://www.linkedin.com/in/national-certification-bureau-ncb-a5a8141b6/,https://x.com/hse_ncb,
Alrabya co.,+96599108162,,,+96599108162,,Kuwait City,Capital Governorate,Kuwait,شركة الرابية لمقاولات تنظيف المباني شركة متخصصة في تنظيف المباني مكافحة الحشرات والقوارض صيانة الحدائق والنباتات الداخلية والخارجية انشاء حدائق Pest Control And Pest Management Providers We employ advanced and most updated Pest management techniques and strategies in order to guarantee our clients a long term Pest Free Environment. Call us for Best Service: (965) 991-08162,https://wa.me/96599108162,https://kuwaitlocal.com/business/alrabya-co,,,,,
