Category,Name,Phone_1,Phone_2,Phone_3,Email,Location,Area,Governorate,Country,About,Website,Fax,URL,Facebook,Instagram,LinkedIn,Twitter,YouTube
accomodation,Al Awayel Furnished Suites,+966 112788000,,,,"Khaleej Dist., Riyadh, Khaleej Dist., Riyadh, Riyadh Province, Saudi Arabia",Khaleej Dist.,Riyadh Province,Saudi Arabia,Al Awayel Furnished Suites,,,https://arablocal.com/business/view/al-awayel-furnished-suites,,,,,
accomodation,Al Baydaa Hotel Group Madinah Al Madinah Al Munawarah,+966 148276800,,,,"Al Salam Street, Madinah, Al Madinah Al Munawarah, Madinah, Al Madinah Al Munawarah, Madinah Province, Saudi Arabia",Al Salam Street,Madinah Province,Saudi Arabia,Al Baydaa Hotel Group Madinah Al Madinah Al Munawarah,,,https://arablocal.com/business/view/al-baydaa-hotel-group-madinah-al-madinah-al-munawarah,,,,,
accomodation,Bahr 4 Hotel,+966 138226324,,,,"King Saud St, Al Anood Dist., Dammam, Al Anood Dist., Dammam, Eastern Province, Saudi Arabia",King Saud St,Eastern Province,Saudi Arabia,Bahr 4 Hotel,,,https://arablocal.com/business/view/bahr-4-hotel,,,,,
accomodation,Marina Suites,+966 114609440,,,,"Al Worood Dist., Riyadh, Al Worood Dist., Riyadh, Riyadh Province, Saudi Arabia",Al Worood Dist.,Riyadh Province,Saudi Arabia,Marina Suites,,,https://arablocal.com/business/view/marina-suites,,,,,
accomodation,The Saudi Factories for Modern Buildings,+966 126203669,,,,"Kilo 16, Old Makkah Road, Jeddah, Old Makkah Road, Jeddah, Makkah Province, Saudi Arabia",Kilo 16,Makkah Province,Saudi Arabia,The Saudi Factories for Modern Buildings,,,https://arablocal.com/business/view/the-saudi-factories-for-modern-buildings,,,,,
accounting,Abdullah I Al Hamzah Chartered Accountants,+966 26755450,,,,"Mushrifah Dist., P.O.Box : 12224, Mushrifah Dist., Mushrifah Dist., Jeddah, Makkah Province, Saudi Arabia",Mushrifah Dist.,Makkah Province,Saudi Arabia,"Abdullah I. Al Hamzah Chartered Accountants Is Located In Jeddah, Saudi Arabia. Company Is Working In Audit And Accounting Business Activities.",,,https://arablocal.com/business/view/abdullah-i-al-hamzah-chartered-accountants,,,,,
accessory,Baynona Est For Trading,+966 14919825,,,,"P.O. Box: 25119 , Riyadh City, Riyadh, Riyadh Province, Saudi Arabia",P.O. Box: 25119,Riyadh Province,Saudi Arabia,"BAYNONA EST FOR TRADING is located in Riyadh, Saudi Arabia. Company is working in Clothing and Accessories, Shoes, Jewellery business activities.",,,https://arablocal.com/business/view/baynona-est-for-trading,,,,,
accounting,Accountant Osamah Ali Tayyar Legal Accountant Office,+966 38333241,,,,"Dist., City, Dist., City, Bareed Dist., Dammam, Eastern Province, Saudi Arabia",Dist.,Eastern Province,Saudi Arabia,"Accountant Osamah Ali Tayyar Legal Accountant Office Is Located In Dammam, Saudi Arabia. Company Is Working In Audit And Accounting Business Activities.",,,https://arablocal.com/business/view/accountant-osamah-ali-tayyar-legal-accountant-office,,,,,
accessory,Basic Est For Children Readymade,+966 14027342,,,,"Riyadh City, Riyadh, Riyadh Province, Saudi Arabia",Riyadh City,Riyadh Province,Saudi Arabia,"BASIC EST FOR CHILDREN READYMADE is located in Riyadh, Saudi Arabia. Company is working in Clothing and Accessories, Shoes business activities.",,,https://arablocal.com/business/view/basic-est-for-children-readymade,,,,,
accounting,Aldar Audit Bureau Abdullah Al Basri And Co Member Of Grant Thornton International,+966 6916883,,,,"P.O.Box No : 20142 21455 , Jeddah, Makkah Province, Saudi Arabia",P.O.Box No : 20142 21455,Makkah Province,Saudi Arabia,"ALDAR AUDIT BUREAU ABDULLAH AL BASRI & CO. MEMBER OF GRANT THORNTON INTERNATIONAL is located in Jeddah, Saudi Arabia. Company is working in Audit and Accounting, Financial Activity business activities. If you have any questions, please contact us",,,https://arablocal.com/business/view/aldar-audit-bureau-abdullah-al-basri--and--co-member-of-grant-thornton-international,,,,,
advertising-&-marketing-services,Bukhari Abdul Hakeem M Advertising Agency,+966 6637322,,,,"P.O.Box No : 18304 21415 , Jeddah, Makkah Province, Saudi Arabia",P.O.Box No : 18304 21415,Makkah Province,Saudi Arabia,"BUKHARI, ABDUL HAKEEM M. ADVERTISING AGENCY is located in Jeddah, Saudi Arabia. Company is working in Advertising, Printing business activities. If you have any questions, please contact us",,,https://arablocal.com/business/view/bukhari-abdul-hakeem-m-advertising-agency,,,,,
accessory,Bajssair Metal Art Works Factory,+966 26380970,,,,"Nazlah Dist., Jeddah, Makkah Province, Saudi Arabia",Nazlah Dist.,Makkah Province,Saudi Arabia,"Bajssair Metal Art Works Factory is located in Jeddah, Saudi Arabia. Company is working in Gifts, Accessories business activities.",,,https://arablocal.com/business/view/bajssair-metal-art-works-factory,,,,,
accomodation,Naya Hotel,+966 558835005,,,,"Nayef Ibn Abd Elaziz Street, Jamaeen Dist., Dammam, Jamaeen Dist., Dammam, Eastern Province, Saudi Arabia",Nayef Ibn Abd Elaziz Street,Eastern Province,Saudi Arabia,,,,https://arablocal.com/business/view/naya-hotel,,,,,
accounting,Abulkhair Bakr And Co Member Firm Of Deloitte Touche Tohmatsu,+966 6572725,,,,"P.O.Box No : 442 21411, Jeddah, Makkah Province, Saudi Arabia",P.O.Box No : 442 21411,Makkah Province,Saudi Arabia,"Abulkhair, Bakr & Co. Member Firm Of Deloitte Touche Tohmatsu Is Located In Jeddah, Saudi Arabia. Company Is Working In Audit And Accounting Business Activities.",,,https://arablocal.com/business/view/abulkhair-bakr--and--co-member-firm-of-deloitte-touche-tohmatsu,,,,,
accounting,Al Nemer Certified Public Accountants,+966 12912333,,,,"Malaz Dist., Riyadh, Riyadh Province, Saudi Arabia",Malaz Dist.,Riyadh Province,Saudi Arabia,"Al Nemer Certified Public Accountants Is Located In Riyadh, Saudi Arabia. Company Is Working In Audit And Accounting Business Activities.",,,https://arablocal.com/business/view/al-nemer-certified-public-accountants,,,,,
advertising-&-marketing-services,Barq Publicity And Advertising Agency,+966 14936663,,,,"Khurais Road, Riyadh, Riyadh Province, Saudi Arabia",Khurais Road,Riyadh Province,Saudi Arabia,"Barq Publicity & Advertising Agency is located in Riyadh, Saudi Arabia. Company is working in Advertising, Advertising Agencies business activities.",,,https://arablocal.com/business/view/barq-publicity--and--advertising-agency,,,,,
accessory,Alshuaiba Est,+966 6630039,,,,"P.O. Box: 43469 , Jeddah, Makkah Province, Saudi Arabia",P.O. Box: 43469,Makkah Province,Saudi Arabia,"AL-SHUAIBA EST. is located in Jeddah, Saudi Arabia. Company is working in Clothing and Accessories, Shoes business activities.",,,https://arablocal.com/business/view/alshuaiba-est,,,,,
accomodation,Al Meknan Residentail Units King Abdul Aziz Road Al Madinah Al Munawarah,+966 148347744,,,,"King Abdul Aziz Road, Al Madinah Al Munawarah, King Abdul Aziz Road, Al Madinah Al Munawarah, Madinah Province, Saudi Arabia",King Abdul Aziz Road,Madinah Province,Saudi Arabia,Al Meknan Residentail Units King Abdul Aziz Road Al Madinah Al Munawarah,,,https://arablocal.com/business/view/al-meknan-residentail-units-king-abdul-aziz-road-al-madinah-al-munawarah,,,,,
accessory,Alnajd Trading Est Branch,+966 6432252,,,,"P.O. Box: 20898 , Jeddah, Makkah Province, Saudi Arabia",P.O. Box: 20898,Makkah Province,Saudi Arabia,"AL-NAJD TRADING EST.(BRANCH). is located in Jeddah, Saudi Arabia. Company is working in Kids, Baby Clothing, Kids Clothing business activities.",,,https://arablocal.com/business/view/alnajd-trading-est-branch,,,,,
accounting,Abdullah Shaheir Legal Accounting Office,+966 72235678,,,,"Asir, Khamis Mushait, Khamis Mushait, Asir, Asir Province, Saudi Arabia",Asir,Asir Province,Saudi Arabia,"Abdullah Shaheir Legal Accounting Office Is Located In Khamis Mushait, Saudi Arabia. Company Is Working In Audit And Accounting Business Activities.",,,https://arablocal.com/business/view/abdullah-shaheir-legal-accounting-office,,,,,
accounting,Al Salamah Accountants And Chartered Auditors,+966 14794490,,,,"Malaz Dist., Riyadh, Riyadh Province, Saudi Arabia",Malaz Dist.,Riyadh Province,Saudi Arabia,"Al Salamah Accountants & Chartered Auditors Is Located In Riyadh, Saudi Arabia. Company Is Working In Audit And Accounting Business Activities.",,,https://arablocal.com/business/view/al-salamah-accountants--and--chartered-auditors,,,,,
advertising-&-marketing-services,Castle Advertising,+966 26631185,,,,"Rouwais Dist., Jeddah, Makkah Province, Saudi Arabia",Rouwais Dist.,Makkah Province,Saudi Arabia,"CASTLE ADVERTISING is located in Jeddah, Saudi Arabia. Company is working in Advertising, Advertising Agencies business activities.",,,https://arablocal.com/business/view/castle-advertising,,,,,
accessory,Alhazmiah Est For Trading And Contracting,+966 6655822,,,,"P.O. Box: 122908 , Jeddah, Makkah Province, Saudi Arabia",P.O. Box: 122908,Makkah Province,Saudi Arabia,"AL-HAZMIAH EST. FOR TRADING AND CONTRACTING is located in Jeddah, Saudi Arabia. Company is working in Kids, Baby Clothing, Kids Clothing business activities.",,,https://arablocal.com/business/view/alhazmiah-est-for-trading-and-contracting,,,,,
advertising-&-marketing-services,Bridges Advertising,+966 26527669,,,,"Abdulhasan Bldg 1st Fl, Hail St, P.O. Box: 434, Abdulhasan Bldg 1st Fl, Hail St , Hail St., Jeddah, Makkah Province, Saudi Arabia",Abdulhasan Bldg 1st Fl,Makkah Province,Saudi Arabia,"Bridges Advertising is located in Jeddah, Saudi Arabia. Company is working in Advertising, Advertising Agencies business activities.",,,https://arablocal.com/business/view/bridges-advertising,,,,,
accomodation,Amasi For Hotel Suites,+966 112131279,,,,"Aziziyah Dist., Riyadh, Aziziyah Dist., Riyadh, Riyadh Province, Saudi Arabia",Aziziyah Dist.,Riyadh Province,Saudi Arabia,Amasi For Hotel Suites,,,https://arablocal.com/business/view/amasi-for-hotel-suites,,,,,
accounting,Al Sayed Al Ayouti And Partners Alhasa,+966 35827381,,,,"Alhasa, Hofuf, Hofuf, Al Hasa, Eastern Province, Saudi Arabia",Alhasa,Eastern Province,Saudi Arabia,"Al Sayed Al Ayouti & Parteners Co. Is Located In Hofuf, Saudi Arabia. Company Is Working In Audit And Accounting Business Activities.",,,https://arablocal.com/business/view/al-sayed-al-ayouti--and--partners-alhasa,,,,,
advertising-&-marketing-services,Basameer Group Co,+966 26518820,,,,"P.O.Box : 12139, Sharafiyah Dist., Jeddah, Makkah Province, Saudi Arabia",P.O.Box : 12139,Makkah Province,Saudi Arabia,"BASAMEER GROUP CO. is located in Jeddah, Saudi Arabia. Company is working in Advertising, Advertising Agencies business activities.",,,https://arablocal.com/business/view/basameer-group-co,,,,,
accessory,Algandol Est For Trading,+966 6822429,,,,"P.O. Box: 3486 , Jeddah, Makkah Province, Saudi Arabia",P.O. Box: 3486,Makkah Province,Saudi Arabia,"AL-GANDOL EST. FOR TRADNING is located in Jeddah, Saudi Arabia. Company is working in Clothing and Accessories, Shoes business activities.",,,https://arablocal.com/business/view/algandol-est-for-trading,,,,,
accomodation,Nojoom Al Jazirah For Furnished Apartments And Suites,+966 144242888,,,,"Ulaya Dist, Tabuk, Ulaya Dist, Tabuk, Tabuk Province, Saudi Arabia",Ulaya Dist,Tabuk Province,Saudi Arabia,Nojoom Al Jazirah For Furnished Apartments And Suites,,,https://arablocal.com/business/view/nojoom-al-jazirah-for-furnished-apartments-and-suites,,,,,
accounting,Al Jrayyed And Partners,+966 26534880,,,,"Sharafiyah, Sharafiyah Dist., Jeddah, Makkah Province, Saudi Arabia",Sharafiyah,Makkah Province,Saudi Arabia,"Al Jrayyed & Partenrs Is Located In Jeddah, Saudi Arabia. Company Is Working In Audit And Accounting Business Activities.",,,https://arablocal.com/business/view/al-jrayyed--and--partners,,,,,
advertising-&-marketing-services,Arabian Service And Marketing Company Riyadh,+966 26517646,,,,"Po Box 55392 11534 , Riyadh City, Riyadh, Riyadh Province, Saudi Arabia",Po Box 55392 11534,Riyadh Province,Saudi Arabia,"ARABIAN SERVICE & MARKETING COMPANY is located in Jeddah, Saudi Arabia. Company is working in business activities.",,,https://arablocal.com/business/view/arabian-service--and--marketing-company-riyadh,,,,,
accounting,Al Sabban Certified Accounts Riyadh,+966 14626235,,,,"Riyadh City, Riyadh, Riyadh Province, Saudi Arabia",Riyadh City,Riyadh Province,Saudi Arabia,"Al Sabban ( Certified Accounts ) Is Located In Riyadh, Saudi Arabia. Company Is Working In Audit And Accounting Business Activities.",,,https://arablocal.com/business/view/al-sabban--certified-accounts--riyadh,,,,,
accessory,Bandar Fahd Hussien Abu Steen Trading Est,+966 6354404,,,,"P.O. Box: 7167 , Jeddah, Makkah Province, Saudi Arabia",P.O. Box: 7167,Makkah Province,Saudi Arabia,"BANDAR FAHD HUSSIEN ABU STEEN TRADING EST. is located in Jeddah, Saudi Arabia. Company is working in Clothing and Accessories, Kids, Baby Clothing, Kids Clothing business activities.",,,https://arablocal.com/business/view/bandar-fahd-hussien-abu-steen-trading-est,,,,,
accomodation,Sahari Hotels Suites,+966 138651200,,,,"Third Street near Prince Street Hammoud, Al Aqrabiyah Dist, Al Khobar, Al Aqrabiyah Dist, Al Khobar, Eastern Province, Saudi Arabia",Third Street near Prince Street Hammoud,Eastern Province,Saudi Arabia,Sahari Hotels Suites,,,https://arablocal.com/business/view/sahari-hotels-suites,,,,,
advertising-&-marketing-services,Best Maintenance And Airport Service,+966 38571449,,,,"Khobar, Al Khobar, Eastern Province, Saudi Arabia",Khobar,Eastern Province,Saudi Arabia,"BEST MAINTENANCE & AIRPORT SERVICE is located in Al Khobar, Saudi Arabia. Company is working in Advertising, Signs, Event Equipment, Exhibition Stands, Event Services business activities.",,,https://arablocal.com/business/view/best-maintenance--and--airport-service,,,,,
accessory,Booh Trading Est,+966 14778788,,,,"P.O. Box: 4199 , Riyadh City, Riyadh, Riyadh Province, Saudi Arabia",P.O. Box: 4199,Riyadh Province,Saudi Arabia,"BOOH TRADING EST is located in Riyadh, Saudi Arabia. Company is working in Clothing and Accessories, Shoes business activities.",,,https://arablocal.com/business/view/booh-trading-est,,,,,
accessory,Bab Al Khair For Gifts And Weddings Games,+966 35851574,,,,"Hofuf, Al Hasa, Eastern Province, Saudi Arabia",Hofuf,Eastern Province,Saudi Arabia,"Bab Al Khair For Gifts & Weddings Games is located in Hofuf, Saudi Arabia. Company is working in Gifts, Accessories business activities.",,,https://arablocal.com/business/view/bab-al-khair-for-gifts--and--weddings-games,,,,,
advertising-&-marketing-services,Basameer Trading Group Co Sulaimaniyah Jeddah,+966 26294318,,,,"Sulaimaniyah , Sulaimaniyah Dist., Jeddah, Makkah Province, Saudi Arabia",Sulaimaniyah,Makkah Province,Saudi Arabia,"Basameer Trading Group Co. is located in Jeddah, Saudi Arabia. Company is working in Advertising business activities.",,,https://arablocal.com/business/view/basameer-trading-group-co-sulaimaniyah-jeddah,,,,,
advertising-&-marketing-services,Brothers Commercial Co Advertising And Public Relations,+966 6606802,,,,"P.O.Box No : 5604 21432 , Jeddah, Makkah Province, Saudi Arabia",P.O.Box No : 5604 21432,Makkah Province,Saudi Arabia,"BROTHERS COMMERCIAL CO. (ADVERTISING & PUBLIC RELATIONS) is located in Jeddah, Saudi Arabia. Company is working in Advertising, Advertising Agencies, Marketing, Training business activities.",,,https://arablocal.com/business/view/brothers-commercial-co-advertising--and--public-relations,,,,,
advertising-&-marketing-services,Ba Samh Marketing Establishment Branch,,,,,"Po Box 57600 11584 , Riyadh City, Riyadh, Riyadh Province, Saudi Arabia",Po Box 57600 11584,Riyadh Province,Saudi Arabia,"BA SAMH MARKETING ESTABLISHMENT (BRANCH) is located in Riyadh, Saudi Arabia. Company is working in business activities.",,,https://arablocal.com/business/view/ba-samh-marketing-establishment--branch,,,,,
accomodation,Fanar Al Jubail Hotel Suites,+966 133617666,,,,"Al Balad, Jubail, Al Balad, Jubail, Eastern Province, Saudi Arabia",Al Balad,Eastern Province,Saudi Arabia,Fanar Al Jubail Hotel Suites,,,https://arablocal.com/business/view/fanar-al-jubail-hotel-suites,,,,,
accounting,Abdullah Mosfir Badran Accounting Office,+966 38980828,,,,"Khobar, Khobar City, Dammam, Eastern Province, Saudi Arabia",Khobar,Eastern Province,Saudi Arabia,"Abdullah Mosfir Badran Accounting Office Is Located In Dammam, Saudi Arabia. Company Is Working In Audit And Accounting Business Activities.",,,https://arablocal.com/business/view/abdullah-mosfir-badran-accounting-office,,,,,
accomodation,Retaj Hotel Suites,+966 114661777,,,,"Ulaya Dist., Riyadh, Ulaya Dist., Riyadh, Riyadh Province, Saudi Arabia",Ulaya Dist.,Riyadh Province,Saudi Arabia,Retaj Hotel Suites,,,https://arablocal.com/business/view/retaj-hotel-suites,,,,,
accounting,Al Sabti Cpa,+966 14761816,,,,"P.O.Box : 9347, Malaz Dist., Riyadh, Riyadh Province, Saudi Arabia",P.O.Box : 9347,Riyadh Province,Saudi Arabia,"Al Sabti Cpa Is Located In Riyadh, Saudi Arabia. Company Is Working In Audit And Accounting Business Activities.",,,https://arablocal.com/business/view/al-sabti-cpa,,,,,
accomodation,Rest Inn Hotel Suites,+966 138899889,,,,"Firas Ibn Al Nudur, Khobar, Al Khobar, Khobar, Al Khobar, Eastern Province, Saudi Arabia",Firas Ibn Al Nudur,Eastern Province,Saudi Arabia,Rest Inn Hotel Suites,http://www.rest-inn.com/,,https://arablocal.com/business/view/rest-inn-hotel-suites,,,,,
accounting,Abdullah Bakdooh Office,+966 38345780,,,,"Bareed Dist., Dammam, Eastern Province, Saudi Arabia",Bareed Dist.,Eastern Province,Saudi Arabia,"Abdullah Bakdooh Office Is Located In Dammam, Saudi Arabia. Company Is Working In Audit And Accounting Business Activities.",,,https://arablocal.com/business/view/abdullah-bakdooh-office,,,,,
accomodation,Jawan Hotel Suites,+966 148222254,,,,"Hijrah Dist., Al Madinah Al Munawarah, Hijrah Dist., Al Madinah Al Munawarah, Madinah Province, Saudi Arabia",Hijrah Dist.,Madinah Province,Saudi Arabia,Jawan Hotel Suites,,,https://arablocal.com/business/view/jawan-hotel-suites,,,,,
accomodation,Al Meknan Hotel,+966 148224466,,,,"Qurbaan St., Al Madinah Al Munawarah, Qurbaan, Al Madinah Al Munawarah, Madinah Province, Saudi Arabia",Qurbaan St.,Madinah Province,Saudi Arabia,Al Meknan Hotel,,,https://arablocal.com/business/view/al-meknan-hotel,,,,,
accounting,Al Mudaiheem Certified Public Accountant,+966 14732020,+966 14728610,,,"P.O.Box : 18025, Malaz Dist., Riyadh, Riyadh Province, Saudi Arabia",P.O.Box : 18025,Riyadh Province,Saudi Arabia,"Al Mudaiheem Certified Public Accountant Is Located In Riyadh, Saudi Arabia. Company Is Working In Audit And Accounting Business Activities.",,,https://arablocal.com/business/view/al-mudaiheem-certified-public-accountant,,,,,
accounting,Partner With The Leading Business Consultancy In Saudi Arabia,+966 550049513,,,info@arabianaccess.com,"Salah Al Din Al Ayoubi Rd, Riyadh , Malaz Kingdom of Saudi Arabia, Riyadh City, Riyadh, Riyadh Province, Saudi Arabia",Salah Al Din Al Ayoubi Rd,Riyadh Province,Saudi Arabia,"With Arabian Access, you can be confident that your financial needs will be met. As the leading accounting firm in Riyadh, Saudi Arabia, we are dedicated to assisting you in achieving your financial objectives by providing dependable, accurate, and timely financial advice and support.Our team of experienced chartered accountants and tax advisors can help you with everything from bookkeeping and payroll management to financial reporting, auditing, and tax planning. We offer a wide range of ser...",http://arabianaccess.com/Business-Accounting,,https://arablocal.com/business/view/partner-with-the-leading-business-consultancy-in-saudi-arabia,https://www.facebook.com/ArabianAccessManagementConsultants/,https://www.instagram.com/arabian_access/,https://www.linkedin.com/company/arabian-access/,https://twitter.com/ArabianAccess,
advertising-&-marketing-services,Artist House Est Advertising,+966 6677199,,,,"P.O. Box: 128210 , Jeddah, Makkah Province, Saudi Arabia",P.O. Box: 128210,Makkah Province,Saudi Arabia,"ARTIST HOUSE EST. ADVERTISING is located in Jeddah, Saudi Arabia. Company is working in Advertising business activities.",,,https://arablocal.com/business/view/artist-house-est-advertising,,,,,
accessory,Ayman T M Al Rasheid Est For Trading,+966 14913286,,,,"Riyadh City, Riyadh, Riyadh Province, Saudi Arabia",Riyadh City,Riyadh Province,Saudi Arabia,"AYMAN T M AL RASHEID EST FOR TRADING is located in Riyadh, Saudi Arabia. Company is working in Clothing and Accessories, Shoes business activities.",,,https://arablocal.com/business/view/ayman-t-m-al-rasheid-est-for-trading,,,,,
accounting,Ahmed A Bajnied And Co Certified Public Accountants,+966 14630050,,,,"Ulaya Dist., P.O.Box : 87293, Ulaya Dist., Ulaya Dist., Riyadh, Riyadh Province, Saudi Arabia",Ulaya Dist.,Riyadh Province,Saudi Arabia,"Ahmed A. Bajnied & Co. Certified Public Accountants Is Located In Riyadh, Saudi Arabia. Company Is Working In Audit And Accounting Business Activities.",,,https://arablocal.com/business/view/ahmed-a-bajnied--and--co-certified-public-accountants,,,,,
accounting,Al Juraid And Co,+966 38952525,,,,"Khobar, Al Khobar, Eastern Province, Saudi Arabia",Khobar,Eastern Province,Saudi Arabia,"Al Juraid & Co Is Located In Al Khobar, Saudi Arabia. Company Is Working In Audit And Accounting Business Activities.",,,https://arablocal.com/business/view/al-juraid--and--co,,,,,
accessory,Amani Muhd Alattass Trading Est,+966 6310230,,,,"P.O. Box: 3170 , Jeddah, Makkah Province, Saudi Arabia",P.O. Box: 3170,Makkah Province,Saudi Arabia,"AMANI MUHD AL-ATTASS TRADING EST. is located in Jeddah, Saudi Arabia. Company is working in Clothing and Accessories, Kids, Baby Clothing, Kids Clothing business activities.",,,https://arablocal.com/business/view/amani-muhd-alattass-trading-est,,,,,
accomodation,Al Mansour Real Estate Office,+966 148844825,,,,"AL ULA, Al Madinah Al Munawarah, AL ULA, Al Madinah Al Munawarah, Madinah Province, Saudi Arabia",AL ULA,Madinah Province,Saudi Arabia,Al Mansour Real Estate Office,,,https://arablocal.com/business/view/al-mansour-real-estate-office,,,,,
advertising-&-marketing-services,Anamel Advertising Co Dammam,+966 38432847,,,,"Lasilki , P.O.Box : 10688, Lasilki , Lasilki, Dammam, Eastern Province, Saudi Arabia",Lasilki,Eastern Province,Saudi Arabia,"ANAMEL ADVERTISING is located in Dammam, Saudi Arabia. Company is working in Advertising, Advertising Agencies business activities.",,,https://arablocal.com/business/view/anamel-advertising-co-dammam,,,,,
accounting,Bashar Est,+966 14992774,,,,"Misfah Dist., Riyadh, Riyadh Province, Saudi Arabia",Misfah Dist.,Riyadh Province,Saudi Arabia,"Bashar Est is located in Riyadh, Saudi Arabia. Company is working in Audit and Accounting business activities.",,,https://arablocal.com/business/view/bashar-est,,,,,
accessory,Amal Naser Fadaag Trading Est,+966 6695460,,,,"P.O. Box: 13887 , Jeddah, Makkah Province, Saudi Arabia",P.O. Box: 13887,Makkah Province,Saudi Arabia,"AMAL NASER FADAAG TRADING EST. is located in Jeddah, Saudi Arabia. Company is working in Clothing and Accessories, Kids, Baby Clothing, Kids Clothing business activities.",,,https://arablocal.com/business/view/amal-naser-fadaag-trading-est,,,,,
accomodation,Al Jomairah Hotel Suites,+966 112263888,,,,"Ashplyah Dist., Riyadh, Ashplyah Dist., Riyadh, Riyadh Province, Saudi Arabia",Ashplyah Dist.,Riyadh Province,Saudi Arabia,Al Jomairah Hotel Suites,,,https://arablocal.com/business/view/al-jomairah-hotel-suites,,,,,
advertising-&-marketing-services,Bradcastang Media Co,+966 14450000,,,,"Khurais Road, Riyadh, Riyadh Province, Saudi Arabia",Khurais Road,Riyadh Province,Saudi Arabia,"Bradcastang Media Co. is located in Riyadh, Saudi Arabia. Company is working in Advertising, Video Production, Film, Television and Video, Media Production business activities.",,,https://arablocal.com/business/view/bradcastang-media-co,,,,,
accounting,Al Salamah Chartered Accountants And Auditors,+966 14794490,,,,"Malaz Dist., Riyadh, Riyadh Province, Saudi Arabia",Malaz Dist.,Riyadh Province,Saudi Arabia,"Al Salamah Chartered Accountants & Auditors Is Located In Riyadh, Saudi Arabia. Company Is Working In Audit And Accounting Business Activities.",,,https://arablocal.com/business/view/al-salamah-chartered-accountants--and--auditors,,,,,
accessory,Allawi Est For Trading,+966 14116632,,,,"Riyadh City, Riyadh, Riyadh Province, Saudi Arabia",Riyadh City,Riyadh Province,Saudi Arabia,"ALLAWI EST FOR TRADING is located in Riyadh, Saudi Arabia. Company is working in Clothing and Accessories, Shoes business activities.",,,https://arablocal.com/business/view/allawi-est-for-trading,,,,,
accomodation,Aryaf Al Dammam Hotel Suites,+966 138095975,,,,"Al Shatei Dist., Dammam, Al Shatei Dist., Dammam, Eastern Province, Saudi Arabia",Al Shatei Dist.,Eastern Province,Saudi Arabia,Aryaf Al Dammam Hotel Suites,,,https://arablocal.com/business/view/aryaf-al-dammam-hotel-suites,,,,,
accomodation,Boudl Onaiza,+966 163637121,,,web@boudl.com,"Unaiza, Qassim, Unaiza, Qassim, Qassim Province, Saudi Arabia",Unaiza,Qassim Province,Saudi Arabia,Boudl Onaiza,http://boudl.com/,,https://arablocal.com/business/view/boudl-onaiza,https://www.facebook.com/boudl.hotels.resorts/,https://www.instagram.com/braira_hotels/,,https://twitter.com/BoudlHotels,https://www.youtube.com/channel/UC2Ci8v8M-DGAIZyT7gtoPsQ
accessory,Alikhtiar Alraqi Establishment For Trading,+966 14643061,,,,"P.O. Box: 41562 , Riyadh City, Riyadh, Riyadh Province, Saudi Arabia",P.O. Box: 41562,Riyadh Province,Saudi Arabia,"ALIKHTIAR ALRAQI EST FOR TRADING is located in Riyadh, Saudi Arabia. Company is working in Clothing and Accessories, Shoes business activities.",,,https://arablocal.com/business/view/alikhtiar-alraqi-establishment-for-trading,,,,,
