Category,Name,Phone_1,Phone_2,Phone_3,Email,Location,Area,Governorate,Country,About,Website,Fax,URL,Facebook,Instagram,LinkedIn,Twitter,YouTube
accomodation,Cooperation Summit For Hotel Apartments And Suites,+966 138090202,,,,"Street 18, Al Salam Dist., Dammam, Al Salam Dist., Dammam, Eastern Province, Saudi Arabia",Street 18,Eastern Province,Saudi Arabia,Cooperation Summit For Hotel Apartments And Suites,,,https://arablocal.com/business/view/cooperation-summit-for-hotel-apartments-and-suites,,,,,
accomodation,Saad Residential Units And Hotel Suites,+966 138970886,,,,"Al Thuqbah, Al Khobar, Al Thuqbah, Al Khobar, Eastern Province, Saudi Arabia",Al Thuqbah,Eastern Province,Saudi Arabia,Saad Residential Units And Hotel Suites,,,https://arablocal.com/business/view/saad-residential-units-and-hotel-suites,,,,,
accomodation,Ratina For Hotel Suites,+966 114711799,,,,"Harun al-Rashid Street, Al Jazeera Dist., Riyadh, Al Jazeera Dist., Riyadh, Riyadh Province, Saudi Arabia",Harun al-Rashid Street,Riyadh Province,Saudi Arabia,Ratina For Hotel Suites,,,https://arablocal.com/business/view/ratina-for-hotel-suites,,,,,
accomodation,Rwaq Hotel Suites Ashplyah Riyadh,+966 550856259,+966 112492166,,,"Imam Mohd. Bin Saud Street, Ashplyah Dist., Riyadh, Ashplyah Dist., Riyadh, Riyadh Province, Saudi Arabia",Imam Mohd. Bin Saud Street,Riyadh Province,Saudi Arabia,Rwaq Hotel Suites Ashplyah Riyadh,,,https://arablocal.com/business/view/rwaq-hotel-suites-ashplyah-riyadh,,,,,
accomodation,Talk To Me Trading Est,+966 114560121,,,,"Riyadh City, Riyadh, Riyadh City, Riyadh, Riyadh Province, Saudi Arabia",Riyadh City,Riyadh Province,Saudi Arabia,Talk To Me Trading Est,,,https://arablocal.com/business/view/talk-to-me-trading-est,,,,,
accomodation,The Palace Hotel Suites,+966 138876047,,,,"In front of Saad Hospital, Al Hizam Alakhdar Dist., Al Khobar, Al Hizam Alakhdar Dist., Al Khobar, Eastern Province, Saudi Arabia",In front of Saad Hospital,Eastern Province,Saudi Arabia,The Palace Hotel Suites,,,https://arablocal.com/business/view/the-palace-hotel-suites,,,,,
accomodation,Radoof Hotels Suites,+966 163826603,,,,"Al Nahda Dist, Buraida, Qassim, Buraida, Qassim, Qassim Province, Saudi Arabia",Al Nahda Dist,Qassim Province,Saudi Arabia,Radoof Hotels Suites,,,https://arablocal.com/business/view/radoof-hotels-suites,,,,,
accomodation,Mandarin Hotel Suites and Flats,+966 503999920,+966 112057711,,,"Al Emam Saud Road, King Abdul Aziz Road, Riyadh, King Abdul Aziz Road, Riyadh, Riyadh Province, Saudi Arabia",Al Emam Saud Road,Riyadh Province,Saudi Arabia,Mandarin Hotel Suites and Flats,,,https://arablocal.com/business/view/mandarin-hotel-suites-and-flats,,,,,
accomodation,Fakhamt Al Hamra For Furnished Suites,+966 126577761,,,,"Al Andalus Street, Al Hamrah Dist, Jeddah, Al Hamrah Dist, Jeddah, Makkah Province, Saudi Arabia",Al Andalus Street,Makkah Province,Saudi Arabia,Fakhamt Al Hamra For Furnished Suites,,,https://arablocal.com/business/view/fakhamt-al-hamra-for-furnished-suites,,,,,
accomodation,Jumaira World For Hotel Suites,+966 138098734,,,,"Bareed Dist., Dammam, Bareed Dist., Dammam, Eastern Province, Saudi Arabia",Bareed Dist.,Eastern Province,Saudi Arabia,Jumaira World For Hotel Suites,,,https://arablocal.com/business/view/jumaira-world-for-hotel-suites,,,,,
accomodation,Golden Prince For Hotel Suites,+966 163263325,,,,"Buraida, Qassim, Buraida, Qassim, Qassim Province, Saudi Arabia",Buraida,Qassim Province,Saudi Arabia,Golden Prince For Hotel Suites,,,https://arablocal.com/business/view/golden-prince-for-hotel-suites,,,,,
accomodation,Rabiyat Al Jawhrah Hotel Suites And Villas,+966 138890060,,,,"Khobar, Al Khobar, Khobar, Al Khobar, Eastern Province, Saudi Arabia",Khobar,Eastern Province,Saudi Arabia,Rabiyat Al Jawhrah Hotel Suites And Villas,,,https://arablocal.com/business/view/rabiyat-al-jawhrah-hotel-suites-and-villas,,,,,
accomodation,Al Khelawi And Boudl Hotels,+966 138090099,,,,"Bareed Dist., Dammam, Bareed Dist., Dammam, Eastern Province, Saudi Arabia",Bareed Dist.,Eastern Province,Saudi Arabia,Al Khelawi And Boudl Hotels,,,https://arablocal.com/business/view/al-khelawi-and-boudl-hotels,,,,,
accomodation,Durat Al Sharq 3 For Hotel Suites,+966 138931166,,,,"Majd Road (5), Khobar City, Dammam, Khobar City, Dammam, Eastern Province, Saudi Arabia",Majd Road (5),Eastern Province,Saudi Arabia,Durat Al Sharq 3 For Hotel Suites,,,https://arablocal.com/business/view/durat-al-sharq-3-for-hotel-suites,,,,,
accomodation,Ghalyah For Hotel Suites,+966 138978855,,,,"Abu Durar El Roumi St., Jawhrah Dist., Al Khobar, Jawhrah Dist., Al Khobar, Eastern Province, Saudi Arabia",Abu Durar El Roumi St.,Eastern Province,Saudi Arabia,Ghalyah For Hotel Suites,,,https://arablocal.com/business/view/ghalyah-for-hotel-suites,,,,,
accomodation,RonzaRose Sea View Al Khobar,,,,,"Khobar Southern, Al Khobar, Khobar Southern, Al Khobar, Eastern Province, Saudi Arabia",Khobar Southern,Eastern Province,Saudi Arabia,RonzaRose Sea View Al Khobar,,,https://arablocal.com/business/view/ronzarose-sea-view-al-khobar,,,,,
accomodation,Ranaad Plaza Jeddah,+966 122651616,,,,"Sabeen Street intersection Arbeen Street, Safa Dist., Jeddah, Safa Dist., Jeddah, Makkah Province, Saudi Arabia",Sabeen Street intersection Arbeen Street,Makkah Province,Saudi Arabia,Ranaad Plaza Jeddah,,,https://arablocal.com/business/view/ranaad-plaza-jeddah,,,,,
accessory,Bassel Ahmead Baaziz Trading Est,+966 6424642,,,,"P.O. Box: 23199 , Jeddah, Makkah Province, Saudi Arabia",P.O. Box: 23199,Makkah Province,Saudi Arabia,"BASSEL AHMEAD BA-AZIZ TRADING EST. is located in Jeddah, Saudi Arabia. Company is working in Kids, Baby Clothing, Kids Clothing business activities.",,,https://arablocal.com/business/view/bassel-ahmead-baaziz-trading-est,,,,,
accessory,Baby House,+966 38290776,,,,"Mujammah, Jeddah, Makkah Province, Saudi Arabia",Mujammah,Makkah Province,Saudi Arabia,"Baby House is located in Dammam, Saudi Arabia. Company is working in Kids, Baby Clothing, Kids Clothing, Kids Shoes business activities.",,,https://arablocal.com/business/view/baby-house,,,,,
accessory,Anwaar Allail Est For Trading,+966 14793523,,,,"Riyadh City, Riyadh, Riyadh Province, Saudi Arabia",Riyadh City,Riyadh Province,Saudi Arabia,"ANWAAR ALLAIL EST FOR TRADING is located in Riyadh, Saudi Arabia. Company is working in Clothing and Accessories, Jewellery business activities.",,,https://arablocal.com/business/view/anwaar-allail-est-for-trading,,,,,
accessory,Anwar A Abdulraqib Trading Est,+966 6443176,,,,"P.O. Box: 24693 , Jeddah, Makkah Province, Saudi Arabia",P.O. Box: 24693,Makkah Province,Saudi Arabia,"ANWAR A. ABDULRAQIB TRADING EST. is located in Jeddah, Saudi Arabia. Company is working in Kids, Baby Clothing, Kids Clothing business activities.",,,https://arablocal.com/business/view/anwar-a-abdulraqib-trading-est,,,,,
accessory,Baghar Childrens Clothing,+966 26482981,,,,"Mujammah, Jeddah, Makkah Province, Saudi Arabia",Mujammah,Makkah Province,Saudi Arabia,"Baghar Children's Clothing is located in Jeddah, Saudi Arabia. Company is working in Kids, Baby Clothing, Kids Clothing, Kids Shoes business activities.",,,https://arablocal.com/business/view/baghar-childrens-clothing,,,,,
accomodation,Lily Hotel Suite Al Hasa,+966 135821621,,,,"Ammar bin Yasir, Al Hazm Dt., Al Hasa, Al Hazm Dt., Al Hasa, Eastern Province, Saudi Arabia",Ammar bin Yasir,Eastern Province,Saudi Arabia,Lily Hotel Suite Al Hasa,,,https://arablocal.com/business/view/lily-hotel-suite-al-hasa,,,,,
accessory,Alkornich Marketing Center,,,,,"P.O. Box: 5700 , Jeddah, Makkah Province, Saudi Arabia",P.O. Box: 5700,Makkah Province,Saudi Arabia,"AL-KORNICH MARKETING CENTER.(BRANCH) is located in Jeddah, Saudi Arabia. Company is working in Clothing and Accessories, Kids, Baby Clothing, Kids Clothing business activities.",,,https://arablocal.com/business/view/alkornich-marketing-center,,,,,
accessory,Branch Sagaaf Hussain A Sagaaf Est,+966 6424712,,,,"P.O. Box: 19296 , Jeddah, Makkah Province, Saudi Arabia",P.O. Box: 19296,Makkah Province,Saudi Arabia,"BRANCH SAGAAF HUSSAIN A. SAGAAF EST. is located in Jeddah, Saudi Arabia. Company is working in Clothing and Accessories, Kids, Baby Clothing, Kids Clothing business activities.",,,https://arablocal.com/business/view/branch-sagaaf-hussain-a-sagaaf-est,,,,,
accessory,Ali Zainuddeen Alshihri Trading Est,+966 6741495,,,,"P.O. Box: 22100 , Jeddah, Makkah Province, Saudi Arabia",P.O. Box: 22100,Makkah Province,Saudi Arabia,"ALI ZAINUDDEEN AL-SHIHRI TRADING EST. is located in Jeddah, Saudi Arabia. Company is working in Kids, Baby Clothing, Kids Clothing business activities.",,,https://arablocal.com/business/view/ali-zainuddeen-alshihri-trading-est,,,,,
accessory,Ben Jalan Contractingr Est,+966 6439172,,,,"P.O. Box: 23360 , Jeddah, Makkah Province, Saudi Arabia",P.O. Box: 23360,Makkah Province,Saudi Arabia,"BEN JALAN CONTR. EST. is located in Jeddah, Saudi Arabia. Company is working in Clothing and Accessories, Shoes business activities.",,,https://arablocal.com/business/view/ben-jalan--contractingr-est,,,,,
accessory,Alharbi Trading Est,+966 6492622,,,,"P.O. Box: 18919 , Jeddah, Makkah Province, Saudi Arabia",P.O. Box: 18919,Makkah Province,Saudi Arabia,"ALHARBI TRADG. EST. is located in Jeddah, Saudi Arabia. Company is working in Kids, Baby Clothing, Kids Clothing business activities.",,,https://arablocal.com/business/view/alharbi-trading-est,,,,,
accomodation,Al Kawther Hotel Suites,+966 138469900,,,,"Al Badiya Dist., Dammam, Al Badiya Dist., Dammam, Eastern Province, Saudi Arabia",Al Badiya Dist.,Eastern Province,Saudi Arabia,Al Kawther Hotel Suites,,,https://arablocal.com/business/view/al-kawther-hotel-suites,,,,,
accomodation,Sanam Hotels Suites,,,,,"Khourais Road Intersection Olya Street, Ulaya Dist., Riyadh, Ulaya Dist., Riyadh, Riyadh Province, Saudi Arabia",Khourais Road Intersection Olya Street,Riyadh Province,Saudi Arabia,Sanam Hotels Suites,,,https://arablocal.com/business/view/sanam-hotels-suites,,,,,
accomodation,Mawasem Al Sharqiah Hotel Suites,+966 172298177,,,,"Abha City, Abha, Abha City, Abha, Asir Province, Saudi Arabia",Abha City,Asir Province,Saudi Arabia,Mawasem Al Sharqiah Hotel Suites,,,https://arablocal.com/business/view/mawasem-al-sharqiah-hotel-suites,,,,,
accomodation,Grandeur East For The Hotel Suites,+966 138673333,,,,"Jawhrah Dist., Al Khobar, Jawhrah Dist., Al Khobar, Eastern Province, Saudi Arabia",Jawhrah Dist.,Eastern Province,Saudi Arabia,Grandeur East For The Hotel Suites,,,https://arablocal.com/business/view/grandeur-east-for-the-hotel-suites,,,,,
accomodation,Qasr Al Maseef Furnished Residential Units,+966 163612222,,,,"Ash Shabili Street, Al Ashrafiyyah District, Unaiza, Qassim, Unaiza, Qassim, Qassim Province, Saudi Arabia",Ash Shabili Street,Qassim Province,Saudi Arabia,Qasr Al Maseef Furnished Residential Units,,,https://arablocal.com/business/view/qasr-al-maseef-furnished-residential-units,,,,,
accomodation,Burjman Furnished Residential Units,+966 135315725,,,,"Makkah, Mubarraz, Al Hasa, Mubarraz, Al Hasa, Eastern Province, Saudi Arabia",Makkah,Eastern Province,Saudi Arabia,Burjman Furnished Residential Units,,,https://arablocal.com/business/view/burjman-furnished-residential-units,,,,,
accomodation,Nahdah Palace For Hotel Suites,+966 112275559,,,,"Salman Al Farsi St., Al Nahdha Dist., Riyadh, Al Nahdha Dist., Riyadh, Riyadh Province, Saudi Arabia",Salman Al Farsi St.,Riyadh Province,Saudi Arabia,Nahdah Palace For Hotel Suites,,,https://arablocal.com/business/view/nahdah-palace-for-hotel-suites,,,,,
accomodation,Boudl Hotels And Resorts,+966 112176666,,,web@boudl.com,"opposite to Al-Faisalya Tower, Ulaya Dist., Riyadh, Ulaya Dist., Riyadh, Riyadh Province, Saudi Arabia",opposite to Al-Faisalya Tower,Riyadh Province,Saudi Arabia,Boudl Hotels And Resorts,http://boudl.com/,,https://arablocal.com/business/view/boudl-hotels-and-resorts,https://www.facebook.com/boudl.hotels.resorts/,https://www.instagram.com/braira_hotels/,,https://twitter.com/BoudlHotels,https://www.youtube.com/channel/UC2Ci8v8M-DGAIZyT7gtoPsQ
accomodation,Ranaad Plaza Al Madinah Al Munawarah,+966 148489320,,,,"Al Hezam, Al Madinah Al Munawarah, Al Hezam, Al Madinah Al Munawarah, Madinah Province, Saudi Arabia",Al Hezam,Madinah Province,Saudi Arabia,Ranaad Plaza Al Madinah Al Munawarah,,,https://arablocal.com/business/view/ranaad-plaza-al-madinah-al-munawarah,,,,,
accessory,Altawon Importing Est,+966 6438211,,,,"P.O. Box: 314 , Jeddah, Makkah Province, Saudi Arabia",P.O. Box: 314,Makkah Province,Saudi Arabia,"AL-TAWON IMPORTING EST. is located in Jeddah, Saudi Arabia. Company is working in Kids, Baby Clothing, Kids Clothing business activities.",,,https://arablocal.com/business/view/altawon-importing-est,,,,,
accessory,Almushni Trading Est Branch,+966 6475990,,,,"P.O. Box: 22164 , Jeddah, Makkah Province, Saudi Arabia",P.O. Box: 22164,Makkah Province,Saudi Arabia,"AL-MUSHNI TRADING EST.(BRANCH). is located in Jeddah, Saudi Arabia. Company is working in Clothing and Accessories, Kids, Baby Clothing, Kids Clothing business activities.",,,https://arablocal.com/business/view/almushni-trading-est-branch,,,,,
accessory,Alkhalaf Trading Est Branch,+966 6440014,,,,"P.O. Box: 11978 , Jeddah, Makkah Province, Saudi Arabia",P.O. Box: 11978,Makkah Province,Saudi Arabia,"AL-KHALAF TRADING EST. (BRANCH) is located in Jeddah, Saudi Arabia. Company is working in Kids, Baby Clothing, Kids Clothing business activities.",,,https://arablocal.com/business/view/alkhalaf-trading-est-branch,,,,,
accessory,Bijaad Ali Al Mutairi Est,+966 6588471,,,,"Jeddah, Makkah Province, Saudi Arabia",Jeddah,Makkah Province,Saudi Arabia,"BIJAAD ALI AL- MUTAIRI EST. is located in Jeddah, Saudi Arabia. Company is working in Kids, Baby Clothing, Kids Clothing business activities.",,,https://arablocal.com/business/view/bijaad-ali--al-mutairi-est,,,,,
accessory,Ali Abu Jabal Trading Est,+966 6060306,,,,"P.O. Box: 10643 , Jeddah, Makkah Province, Saudi Arabia",P.O. Box: 10643,Makkah Province,Saudi Arabia,"ALI ABU JABAL TRADING EST. is located in Jeddah, Saudi Arabia. Company is working in Kids, Baby Clothing, Kids Clothing business activities.",,,https://arablocal.com/business/view/ali-abu-jabal-trading-est,,,,,
accessory,Ali Mohamed Modawi Alsheihri Trading Est,+966 2354853,,,,"P.O. Box: 31463 , Jeddah, Makkah Province, Saudi Arabia",P.O. Box: 31463,Makkah Province,Saudi Arabia,"ALI MOHAMED MODAWI AL-SHEIHRI TRADING EST. is located in Jeddah, Saudi Arabia. Company is working in Kids, Baby Clothing, Kids Clothing business activities.",,,https://arablocal.com/business/view/ali-mohamed-modawi-alsheihri-trading-est,,,,,
accessory,Alulu Stores,+966 6481539,,,,"P.O. Box: 5711 , Jeddah, Makkah Province, Saudi Arabia",P.O. Box: 5711,Makkah Province,Saudi Arabia,"ALULU STORES is located in Jeddah, Saudi Arabia. Company is working in Clothing and Accessories, Kids, Baby Clothing, Kids Clothing business activities.",,,https://arablocal.com/business/view/alulu-stores,,,,,
accessory,Bajubair Fashions Est,+966 6523055,,,,"P.O. Box: 33826 , Jeddah, Makkah Province, Saudi Arabia",P.O. Box: 33826,Makkah Province,Saudi Arabia,"BA-JUBAIR FASHIONS EST. is located in Jeddah, Saudi Arabia. Company is working in Clothing and Accessories, Kids, Baby Clothing, Kids Clothing business activities.",,,https://arablocal.com/business/view/bajubair-fashions-est,,,,,
accessory,Babameyan Trading Est,+966 6478261,,,,"P.O. Box: 22148 , Jeddah, Makkah Province, Saudi Arabia",P.O. Box: 22148,Makkah Province,Saudi Arabia,"BABAMEYAN TRADING EST. is located in Jeddah, Saudi Arabia. Company is working in Clothing and Accessories, Kids, Baby Clothing, Kids Clothing business activities.",,,https://arablocal.com/business/view/babameyan-trading-est,,,,,
accessory,Atyaf Kids Wares Showroom,+966 15488480,,,,"Al Kharj, Riyadh Province, Saudi Arabia",Al Kharj,Riyadh Province,Saudi Arabia,"Atyaf Kids Wares Showroom is located in Riyadh, Saudi Arabia. Company is working in Kids, Baby Clothing, Kids Clothing, Kids Shoes business activities.",,,https://arablocal.com/business/view/atyaf-kids-wares-showroom,,,,,
accessory,Aluminium Products Co Ltd Alupco Riyadh,+966 14749040,,,,"Po Box 2249; 11451 , Riyadh City, Riyadh, Riyadh Province, Saudi Arabia",Po Box 2249; 11451,Riyadh Province,Saudi Arabia,"ALUMINIUM PRODUCTS CO LTD ( ALUPCO ) is located in Riyadh, Saudi Arabia. Company is working in Clothing and Accessories, Textile business activities. Visit our company website for more information about us : http://alupco.com If you have any questions, please contact us",,,https://arablocal.com/business/view/aluminium-products-co-ltd--alupco-riyadh,,,,,
accessory,Alqubtaan The Captain,+966 6987686,,,,"P.O. Box: 116797 , Jeddah, Makkah Province, Saudi Arabia",P.O. Box: 116797,Makkah Province,Saudi Arabia,"AL-QUBTAAN (THE CAPTAIN) is located in Jeddah, Saudi Arabia. Company is working in Kids, Baby Clothing, Kids Clothing business activities.",,,https://arablocal.com/business/view/alqubtaan-the-captain,,,,,
accessory,Alreem Alsaudiyyah International Trading Co,+966 6434099,,,,"P.O. Box: 15324 , Jeddah, Makkah Province, Saudi Arabia",P.O. Box: 15324,Makkah Province,Saudi Arabia,"AL-REEM AL-SAUDIYYAH INL TRADING CO. is located in Jeddah, Saudi Arabia. Company is working in Kids, Baby Clothing, Kids Clothing business activities.",,,https://arablocal.com/business/view/alreem-alsaudiyyah-international-trading-co,,,,,
accessory,Alnawafig Trading Est,+966 2840508,,,,"P.O. Box: 18980 , Jeddah, Makkah Province, Saudi Arabia",P.O. Box: 18980,Makkah Province,Saudi Arabia,"AL-NAWAFIG TRADING EST. is located in Jeddah, Saudi Arabia. Company is working in Kids, Baby Clothing, Kids Clothing business activities.",,,https://arablocal.com/business/view/alnawafig-trading-est,,,,,
accessory,Alneel Fashions Est For Trading,+966 6423846,,,,"P.O. Box: 5033 , Jeddah, Makkah Province, Saudi Arabia",P.O. Box: 5033,Makkah Province,Saudi Arabia,"AL-NEEL FASHIONS EST.FOR TRADING. is located in Jeddah, Saudi Arabia. Company is working in Kids, Baby Clothing, Kids Clothing business activities.",,,https://arablocal.com/business/view/alneel-fashions-est-for-trading,,,,,
accessory,Alnashmah Est,+966 6472797,,,,"P.O. Box: 19693 , Jeddah, Makkah Province, Saudi Arabia",P.O. Box: 19693,Makkah Province,Saudi Arabia,"AL-NASHMAH EST. is located in Jeddah, Saudi Arabia. Company is working in Kids, Baby Clothing, Kids Clothing business activities.",,,https://arablocal.com/business/view/alnashmah-est,,,,,
accessory,Ali S Abdulla Bakarim Buildings Maintenance Est,+966 6481912,,,,"P.O. Box: 18973 , Jeddah, Makkah Province, Saudi Arabia",P.O. Box: 18973,Makkah Province,Saudi Arabia,"ALI S. ABDULLA BA-KARIM BUILDINGS MAINTENANCE EST. is located in Jeddah, Saudi Arabia. Company is working in Clothing and Accessories, Kids, Baby Clothing, Kids Clothing business activities.",,,https://arablocal.com/business/view/ali-s-abdulla-bakarim-buildings-maintenance-est,,,,,
accessory,Alheraibi Trading Est Branch Jeddah Branch,+966 6492622,,,,"P.O. Box: 18919 , Jeddah, Makkah Province, Saudi Arabia",P.O. Box: 18919,Makkah Province,Saudi Arabia,"AL-HERAIBI TRADING EST.(BRANCH). is located in Jeddah, Saudi Arabia. Company is working in Clothing and Accessories, Kids, Baby Clothing, Kids Clothing business activities.",,,https://arablocal.com/business/view/alheraibi-trading-est-branch-jeddah-branch,,,,,
accessory,Ali Hussain Abdulla Alesaye Est,+966 6609632,,,,"P.O. Box: 4828 , Jeddah, Makkah Province, Saudi Arabia",P.O. Box: 4828,Makkah Province,Saudi Arabia,"ALI HUSSAIN ABDULLA AL-ESAYE EST is located in Jeddah, Saudi Arabia. Company is working in Kids, Baby Clothing, Kids Clothing business activities.",,,https://arablocal.com/business/view/ali-hussain-abdulla-alesaye-est,,,,,
accessory,Alfalwah Horses Supplies Est,+966 6196421,,,,"P.O. Box: 110139 , Jeddah, Makkah Province, Saudi Arabia",P.O. Box: 110139,Makkah Province,Saudi Arabia,"AL-FALWAH HORSES SUPPLIES EST. is located in Jeddah, Saudi Arabia. Company is working in Kids, Baby Clothing, Kids Clothing business activities.",,,https://arablocal.com/business/view/alfalwah-horses-supplies-est,,,,,
accomodation,Manazel Al Rayyan Hotel Suites,+966 114915036,,,,"Ar Rayyan Dist., Riyadh, Ar Rayyan Dist., Riyadh, Riyadh Province, Saudi Arabia",Ar Rayyan Dist.,Riyadh Province,Saudi Arabia,Manazel Al Rayyan Hotel Suites,,,https://arablocal.com/business/view/manazel-al-rayyan-hotel-suites,,,,,
accomodation,Manazel Al Durah Hotel Suites,,,,,"Second Ring, Al Madinah Al Munawarah, Second Ring, Al Madinah Al Munawarah, Madinah Province, Saudi Arabia",Second Ring,Madinah Province,Saudi Arabia,Manazel Al Durah Hotel Suites,,,https://arablocal.com/business/view/manazel-al-durah-hotel-suites,,,,,
accomodation,Golden Prince No. 1,+966 163271111,,,,"King Khalid Road, Ar Rabwah, Buraida, Qassim, Buraida, Qassim, Qassim Province, Saudi Arabia",King Khalid Road,Qassim Province,Saudi Arabia,Golden Prince No. 1,,,https://arablocal.com/business/view/golden-prince-no-1,,,,,
accomodation,Dyafah Al Saati Jeddah,+966 126398080,,,,"Prince Majed Street, Aziziyah Dist., Jeddah, Aziziyah Dist., Jeddah, Makkah Province, Saudi Arabia",Prince Majed Street,Makkah Province,Saudi Arabia,Dyafah Al Saati Jeddah,,,https://arablocal.com/business/view/dyafah-al-saati-jeddah,,,,,
accomodation,Nuzl Tabah For Furnished Suites,+966 148590888,,,,"Al Emam Al Bukhay Street, Aziziyah Dist., Al Madinah Al Munawarah, Aziziyah Dist., Al Madinah Al Munawarah, Madinah Province, Saudi Arabia",Al Emam Al Bukhay Street,Madinah Province,Saudi Arabia,Nuzl Tabah For Furnished Suites,,,https://arablocal.com/business/view/nuzl-tabah-for-furnished-suites,,,,,
accomodation,Al Jmairah Furnished Hotel Suites,+966 138895456,,,,"Khobar, Al Khobar, Khobar, Al Khobar, Eastern Province, Saudi Arabia",Khobar,Eastern Province,Saudi Arabia,Al Jmairah Furnished Hotel Suites,,,https://arablocal.com/business/view/al-jmairah-furnished-hotel-suites,,,,,
accessory,Alessayi United Trading And Industry Co,+966 6040000,,,,"P.O. Box: 3035 , Jeddah, Makkah Province, Saudi Arabia",P.O. Box: 3035,Makkah Province,Saudi Arabia,"AL-ESSAYI UNITED TRADING AND INDUSTRY CO. is located in Jeddah, Saudi Arabia. Company is working in Kids, Baby Clothing, Kids Clothing business activities.",,,https://arablocal.com/business/view/alessayi-united-trading-and-industry-co,,,,,
accomodation,Al Rashoudi For Furnished Apartments,+966 112780703,,,,"Khaleej Dist., Riyadh, Khaleej Dist., Riyadh, Riyadh Province, Saudi Arabia",Khaleej Dist.,Riyadh Province,Saudi Arabia,Al Rashoudi For Furnished Apartments,,,https://arablocal.com/business/view/al-rashoudi-for-furnished-apartments,,,,,
advertising-&-marketing-services,Asam Advertising Agency,+966 14412583,,,,"Riyadh City, Riyadh, Riyadh Province, Saudi Arabia",Riyadh City,Riyadh Province,Saudi Arabia,"ASAM ADVERTISING AGENCY is located in Riyadh, Saudi Arabia. Company is working in Advertising, Advertising Agencies business activities.",,,https://arablocal.com/business/view/asam-advertising-agency,,,,,
accessory,Ayesh Corporation For Commerce And Industry,+966 14025006,,,,"Riyadh City, Riyadh, Riyadh Province, Saudi Arabia",Riyadh City,Riyadh Province,Saudi Arabia,"AYESH CORP FOR COMMERCE & INDUSTRY is located in Riyadh, Saudi Arabia. Company is working in Clothing and Accessories, Electrical Goods business activities.",,,https://arablocal.com/business/view/ayesh-corporation-for-commerce--and--industry,,,,,
accomodation,Marabia For Hotel Suites,+966 138460006,,,,"King Fahd Road, Dammam, King Fahd Road, Dammam, Eastern Province, Saudi Arabia",King Fahd Road,Eastern Province,Saudi Arabia,Marabia For Hotel Suites,,,https://arablocal.com/business/view/marabia-for-hotel-suites,,,,,
accessory,Awadh Eessa Albiladi Trading Est,+966 6748074,,,,"Jeddah, Makkah Province, Saudi Arabia",Jeddah,Makkah Province,Saudi Arabia,"AWADH EESSA AL-BILADI TRADING EST. is located in Jeddah, Saudi Arabia. Company is working in Clothing and Accessories, Kids, Baby Clothing, Kids Clothing business activities.",,,https://arablocal.com/business/view/awadh-eessa-albiladi-trading-est,,,,,
accomodation,Al Dheyafah Hotel Suites,+966 114260131,,,,"Ulaya Dist., Riyadh, Ulaya Dist., Riyadh, Riyadh Province, Saudi Arabia",Ulaya Dist.,Riyadh Province,Saudi Arabia,Al Dheyafah Hotel Suites,,,https://arablocal.com/business/view/al-dheyafah-hotel-suites,,,,,
accessory,Awad Edhah Alrashdi Est,+966 6320835,,,,"Jeddah, Makkah Province, Saudi Arabia",Jeddah,Makkah Province,Saudi Arabia,"AWAD EDHAH AL-RASHDI EST. is located in Jeddah, Saudi Arabia. Company is working in Clothing and Accessories, Kids, Baby Clothing, Kids Clothing business activities.",,,https://arablocal.com/business/view/awad-edhah-alrashdi-est,,,,,
advertising-&-marketing-services,Arfaj Agency For Advertisement And Publicity,+966 14224286,,,,"Riyadh City, Riyadh, Riyadh Province, Saudi Arabia",Riyadh City,Riyadh Province,Saudi Arabia,"ARFAJ AGENCY FOR ADVERTISEMENT & PUBLICITY is located in Riyadh, Saudi Arabia. Company is working in Advertising, Advertising Agencies business activities.",,,https://arablocal.com/business/view/arfaj-agency-for-advertisement--and--publicity,,,,,
accomodation,Mashaal Tabuk For Furnished Apartment,+966 508050905,,,,"Prince Abdul Majed Street, Tabuk City, Tabuk, Tabuk City, Tabuk, Tabuk Province, Saudi Arabia",Prince Abdul Majed Street,Tabuk Province,Saudi Arabia,Mashaal Tabuk For Furnished Apartment,,,https://arablocal.com/business/view/mashaal-tabuk-for-furnished-apartment,,,,,
accomodation,Rotana Apartments For Hotel Suites,+966 138931000,,,,"Jawhrah Dist., Al Khobar, Jawhrah Dist., Al Khobar, Eastern Province, Saudi Arabia",Jawhrah Dist.,Eastern Province,Saudi Arabia,Rotana Apartments For Hotel Suites,,,https://arablocal.com/business/view/rotana-apartments-for-hotel-suites,,,,,
