Category,Name,Phone_1,Phone_2,Phone_3,Email,Location,Area,Governorate,Country,About,Website,Fax,URL,Facebook,Instagram,LinkedIn,Twitter,YouTube
accounting,Abdullah I Alhamza Chartered Accountants,,,,,"Po Box 27241 11417, Riyadh City, Riyadh, Riyadh Province, Saudi Arabia",Po Box 27241 11417,Riyadh Province,Saudi Arabia,"Abdullah I. Al-Hamza )Chartered Accountants( Is Located In Riyadh, Saudi Arabia. Company Is Working In Audit And Accounting Business Activities.",,,https://arablocal.com/business/view/abdullah-i-alhamza-chartered-accountants,,,,,
accounting,Al Jrayyed And Partners Legal Accountants Co,+966 14631805,,,,"Ulaya, Ulaya Dist., Riyadh, Riyadh Province, Saudi Arabia",Ulaya,Riyadh Province,Saudi Arabia,"Al Jrayyed & Partners Legal Accountants Co. Is Located In Riyadh, Saudi Arabia. Company Is Working In Audit And Accounting Business Activities.",,,https://arablocal.com/business/view/al-jrayyed--and--partners-legal-accountants-co,,,,,
accounting,Abdulazim Z Bishr Certified Accountants Riyadh,+966 14110061,,,,"Riyadh City, Riyadh, Riyadh Province, Saudi Arabia",Riyadh City,Riyadh Province,Saudi Arabia,"Abdulazim Z Bishr Certified Accountants Is Located In Riyadh, Saudi Arabia. Company Is Working In Audit And Accounting Business Activities.",,,https://arablocal.com/business/view/abdulazim-z-bishr-certified-accountants-riyadh,,,,,
accounting,Al Sayed Al Ayouty And Partners Co Alhasa Branch,+966 35860105,,,,"Alhasa, Hofuf, Hofuf, Al Hasa, Eastern Province, Saudi Arabia",Alhasa,Eastern Province,Saudi Arabia,"Al Sayed Al Ayouty & Partners Co. Is Located In Hofuf, Saudi Arabia. Company Is Working In Audit And Accounting Business Activities.",,,https://arablocal.com/business/view/al-sayed-al-ayouty--and--partners-co-alhasa-branch,,,,,
accounting,Al Dar Account Auditing Co Dammam,+966 38960528,+966 38657484,,,"Khobar, Khobar City, Dammam, Eastern Province, Saudi Arabia",Khobar,Eastern Province,Saudi Arabia,"Al Dar Account Auditing Co. Is Located In Dammam, Saudi Arabia. Company Is Working In Audit And Accounting Business Activities.",,,https://arablocal.com/business/view/al-dar-account-auditing-co-dammam,,,,,
accounting,Ahmed Abdullah Bajnied Certified Accountants,+966 26654424,,,,"Jeddah, Makkah Province, Saudi Arabia",Jeddah,Makkah Province,Saudi Arabia,"Ahmed Abdullah Bajnied Certified Accountants Is Located In Jeddah, Saudi Arabia. Company Is Working In Audit And Accounting Business Activities.",,,https://arablocal.com/business/view/ahmed-abdullah-bajnied-certified-accountants,,,,,
accessory,Basem A Al Habshi Est For Trading,+966 14956139,,,,"Riyadh City, Riyadh, Riyadh Province, Saudi Arabia",Riyadh City,Riyadh Province,Saudi Arabia,"BASEM A AL HABSHI EST FOR TRADING is located in Riyadh, Saudi Arabia. Company is working in Clothing and Accessories, Shoes business activities.",,,https://arablocal.com/business/view/basem-a-al-habshi-est-for-trading,,,,,
accessory,Allarakia Trading Co Jeddah Branch,+966 6420421,,,,"P.O. Box: 186 , Jeddah, Makkah Province, Saudi Arabia",P.O. Box: 186,Makkah Province,Saudi Arabia,"AL-LARAKIA TRADING CO. is located in Jeddah, Saudi Arabia. Company is working in Kids, Baby Clothing, Kids Clothing business activities.",,,https://arablocal.com/business/view/allarakia-trading-co-jeddah-branch,,,,,
accessory,Brand For Less Trading Co,+966 6606699,,,,"P.O. Box: 5967 , Jeddah, Makkah Province, Saudi Arabia",P.O. Box: 5967,Makkah Province,Saudi Arabia,"BRAND FOR LESS TRADING CO. is located in Jeddah, Saudi Arabia. Company is working in Clothing and Accessories, Shoes business activities.",,,https://arablocal.com/business/view/brand-for-less-trading-co,,,,,
accessory,Balas Est For Trading,+966 14633636,,,,"Riyadh City, Riyadh, Riyadh Province, Saudi Arabia",Riyadh City,Riyadh Province,Saudi Arabia,"BALAS EST FOR TRADING is located in Riyadh, Saudi Arabia. Company is working in Clothing and Accessories, Shoes business activities.",,,https://arablocal.com/business/view/balas-est-for-trading,,,,,
accessory,Alhomaidi Bin Mohammed Al Daidan Est For Trading,+966 14254682,,,,"Riyadh City, Riyadh, Riyadh Province, Saudi Arabia",Riyadh City,Riyadh Province,Saudi Arabia,"ALHOMAIDI BIN MOHAMMED AL DAIDAN EST FOR TRADING is located in Riyadh, Saudi Arabia. Company is working in Clothing and Accessories, Shoes business activities.",,,https://arablocal.com/business/view/alhomaidi-bin-mohammed-al-daidan-est-for-trading,,,,,
accessory,Ashwaq M Ahmed Nashar Trading Est,+966 6435912,,,,"P.O. Box: 104423 , Jeddah, Makkah Province, Saudi Arabia",P.O. Box: 104423,Makkah Province,Saudi Arabia,"ASHWAQ M. AHMED NASHAR TRADING EST. is located in Jeddah, Saudi Arabia. Company is working in Clothing and Accessories, Kids, Baby Clothing, Kids Clothing business activities.",,,https://arablocal.com/business/view/ashwaq-m-ahmed-nashar-trading-est,,,,,
accessory,Alrakab Est For Trading,+966 12332804,,,,"Riyadh City, Riyadh, Riyadh Province, Saudi Arabia",Riyadh City,Riyadh Province,Saudi Arabia,"ALRAKAB EST FOR TRADING is located in Riyadh, Saudi Arabia. Company is working in Clothing and Accessories, Shoes business activities.",,,https://arablocal.com/business/view/alrakab-est-for-trading,,,,,
accessory,Asim A Mohsin Trading Est,+966 6530085,,,,"P.O. Box: 1183 , Jeddah, Makkah Province, Saudi Arabia",P.O. Box: 1183,Makkah Province,Saudi Arabia,"ASIM A. MOHSIN TRADG. EST. is located in Jeddah, Saudi Arabia. Company is working in Clothing and Accessories, Shoes business activities.",,,https://arablocal.com/business/view/asim-a-mohsin-trading-est,,,,,
accessory,Bin Shaiyhoon Kids Wears Store,+966 26489843,,,,"Mujammah, Jeddah, Makkah Province, Saudi Arabia",Mujammah,Makkah Province,Saudi Arabia,"Bin Shaiyhoon Kids Wears Store is located in Jeddah, Saudi Arabia. Company is working in Kids, Baby Clothing, Kids Clothing, Kids Shoes business activities.",,,https://arablocal.com/business/view/bin-shaiyhoon-kids-wears-store,,,,,
accessory,Bait Al Sakhaa Est For Trading,+966 14620003,,,,"Riyadh City, Riyadh, Riyadh Province, Saudi Arabia",Riyadh City,Riyadh Province,Saudi Arabia,"BAIT AL SAKHAA EST FOR TRADING is located in Riyadh, Saudi Arabia. Company is working in Clothing and Accessories, Shoes business activities.",,,https://arablocal.com/business/view/bait-al-sakhaa-est-for-trading,,,,,
accomodation,Al Khobar Crystal Hotel And Suites,+966 138945000,,,,"Ulaya Dist., Al Khobar, Ulaya Dist., Al Khobar, Eastern Province, Saudi Arabia",Ulaya Dist.,Eastern Province,Saudi Arabia,Al Khobar Crystal Hotel And Suites,,,https://arablocal.com/business/view/al-khobar-crystal-hotel-and-suites,,,,,
accomodation,Boudl Al Massif,+966 114559841,,,web@boudl.com,"Northern Ring Road, Al Maseef Dist., Riyadh, Al Maseef Dist., Riyadh, Riyadh Province, Saudi Arabia",Northern Ring Road,Riyadh Province,Saudi Arabia,Boudl Al Massif,http://boudl.com/,,https://arablocal.com/business/view/boudl-al-massif,https://www.facebook.com/boudl.hotels.resorts/,https://www.instagram.com/braira_hotels/,,https://twitter.com/BoudlHotels,https://www.youtube.com/channel/UC2Ci8v8M-DGAIZyT7gtoPsQ
accomodation,Mlfai Hotel Suites,+966 138447704,,,,"King Khalid street, Qazzaz Dist., Dammam, Qazzaz Dist., Dammam, Eastern Province, Saudi Arabia",King Khalid street,Eastern Province,Saudi Arabia,Mlfai Hotel Suites,,,https://arablocal.com/business/view/mlfai-hotel-suites,,,,,
accomodation,Al Adheriyah For Hotel Suites,+966 138972280,,,,"Jawhrah Dist., Al Khobar, Jawhrah Dist., Al Khobar, Eastern Province, Saudi Arabia",Jawhrah Dist.,Eastern Province,Saudi Arabia,Al Adheriyah For Hotel Suites,,,https://arablocal.com/business/view/al-adheriyah-for-hotel-suites,,,,,
accomodation,Al Owayed Hotel,+966 138095555,,,,"Khalij Road, Al Hamra Dist., Dammam, Al Hamra Dist., Dammam, Eastern Province, Saudi Arabia",Khalij Road,Eastern Province,Saudi Arabia,Al Owayed Hotel,,,https://arablocal.com/business/view/al-owayed-hotel,,,,,
accomodation,Sunset Hotel - Jeddah,+966 126605000,,,,"Al Rawda St. Intersection Al Madinah Road, Al Rowdah Dist., Jeddah, Al Rowdah Dist., Jeddah, Makkah Province, Saudi Arabia",Al Rawda St. Intersection Al Madinah Road,Makkah Province,Saudi Arabia,Sunset Hotel - Jeddah,,,https://arablocal.com/business/view/sunset-hotel-jeddah,,,,,
accomodation,Amasi Al Fayhaa For Bachelor,+966 549888447,,,,"King Faisal Street West, Jubail, King Faisal Street West, Jubail, Eastern Province, Saudi Arabia",King Faisal Street West,Eastern Province,Saudi Arabia,Amasi Al Fayhaa For Bachelor,,,https://arablocal.com/business/view/amasi-al-fayhaa-for-bachelor,,,,,
accomodation,Jawharat Al Danah Furnished Apartments,+966 138897227,,,,"Jawhrah Dist., Al Khobar, Jawhrah Dist., Al Khobar, Eastern Province, Saudi Arabia",Jawhrah Dist.,Eastern Province,Saudi Arabia,Jawharat Al Danah Furnished Apartments,,,https://arablocal.com/business/view/jawharat-al-danah-furnished-apartments,,,,,
accomodation,Enmaa Ready Houses Factory,+966 114155562,,,,"Kharj Road, Riyadh, Kharj Road, Riyadh, Riyadh Province, Saudi Arabia",Kharj Road,Riyadh Province,Saudi Arabia,Enmaa Ready Houses Factory,,,https://arablocal.com/business/view/enmaa-ready-houses-factory,,,,,
accomodation,Flowers Palace,+966 148261558,,,,"Qurbaan St., Al Madinah Al Munawarah, Qurbaan, Al Madinah Al Munawarah, Madinah Province, Saudi Arabia",Qurbaan St.,Madinah Province,Saudi Arabia,Flowers Palace,,,https://arablocal.com/business/view/flowers-palace,,,,,
accounting,Abdullah Alhudaithi Management Consultancy Office,,,,,"Po Box 304 11411, Riyadh City, Riyadh, Riyadh Province, Saudi Arabia",Po Box 304 11411,Riyadh Province,Saudi Arabia,"Abdullah Al-Hudaithi Management Consultancy Office Is Located In Riyadh, Saudi Arabia. Company Is Working In Audit And Accounting Business Activities.",,,https://arablocal.com/business/view/abdullah-alhudaithi-management-consultancy-office,,,,,
accounting,Abdulaziz T Al Sudairy Certified Accountants,+966 14651898,,,,"Riyadh City, Riyadh, Riyadh Province, Saudi Arabia",Riyadh City,Riyadh Province,Saudi Arabia,"Abdulaziz T Al Sudairy ( Certified Accountants ) Is Located In Riyadh, Saudi Arabia. Company Is Working In Audit And Accounting Business Activities.",,,https://arablocal.com/business/view/abdulaziz-t-al-sudairy--certified-accountants-,,,,,
accounting,Al Saleh Accounting Office,+966 14724140,,,,"Malaz Dist., Riyadh, Riyadh Province, Saudi Arabia",Malaz Dist.,Riyadh Province,Saudi Arabia,"Al Saleh Accounting Office Is Located In Riyadh, Saudi Arabia. Company Is Working In Audit And Accounting Business Activities.",,,https://arablocal.com/business/view/al-saleh-accounting-office,,,,,
accounting,Al Juraid And Co Certified Public Accountants,+966 26534880,,,,"Jeddah, Makkah Province, Saudi Arabia",Jeddah,Makkah Province,Saudi Arabia,"Al Juraid & Co Certified Public Accountants Is Located In Jeddah, Saudi Arabia. Company Is Working In Audit And Accounting Business Activities.",,,https://arablocal.com/business/view/al-juraid--and--co-certified-public-accountants,,,,,
accounting,Kayan Software Saudi Arabia,+966 594774201,,,sales@kayansoftware.com,"Suite 3558, Khalid Bin Al Walid 7527, Ar Rakah Ash Shamaliyah Dist, Dammam 34225, Kingdom Of Saudi Arabia, Dammam, Eastern Province, Saudi Arabia",Suite 3558,Eastern Province,Saudi Arabia,"Have you been looking for delicate yet robust business automation to uplift your business venture? Then you have just got the most legitimate source to acquire top-in-line ERP implementation services from the industry-leading ERP Business Consultant in town! It's time to hoist efficiency with the most accurate business solution you have ever had.Regarding Kayan, we deliver you a tailored ERP solution designed and developed to cater to the needs of start-ups, mid-range, and time-honored busine...",http://kayansoftware.com/,,https://arablocal.com/business/view/sap-software-for-small-business--kayan-software,https://www.facebook.com/KayanSoftwareKSA/,https://www.instagram.com/kayansoftware/,https://www.linkedin.com/company/kayan-software/,https://twitter.com/KayanSoftware,
accounting,Al Bayoumi Legal Accountants And Audits,+966 14794542,,,,"Malaz Dist., Riyadh, Riyadh Province, Saudi Arabia",Malaz Dist.,Riyadh Province,Saudi Arabia,"Al Bayoumi Legal Accountants & Audits Is Located In Riyadh, Saudi Arabia. Company Is Working In Audit And Accounting Business Activities.",,,https://arablocal.com/business/view/al-bayoumi-legal-accountants--and--audits,,,,,
accounting,Ahmed Al Zamil Certified Public Accountants And Management,+966 38272314,,,,"Mujammah Dist., City, P.O.Box : 6224, Mujammah Dist., City, Mujammah Dist., Dammam, Eastern Province, Saudi Arabia",Mujammah Dist.,Eastern Province,Saudi Arabia,"Ahmed Al Zamil Certified Public Accountants & Management Is Located In Dammam, Saudi Arabia. Company Is Working In Audit And Accounting Business Activities.",,,https://arablocal.com/business/view/ahmed-al-zamil-certified-public-accountants--and--management,,,,,
accounting,Al Ghanim Office,+966 14604055,,,,"Ulaya, Ulaya Dist., Riyadh, Riyadh Province, Saudi Arabia",Ulaya,Riyadh Province,Saudi Arabia,"Al Ghanim Office Is Located In Riyadh, Saudi Arabia. Company Is Working In Audit And Accounting Business Activities.",,,https://arablocal.com/business/view/al-ghanim-office,,,,,
accounting,Betterhomes,+966 22841012,,,,"P.O.Box : 8250, Rouwais Dist., Jeddah, Makkah Province, Saudi Arabia",P.O.Box : 8250,Makkah Province,Saudi Arabia,"BETTERHOMES is located in Jeddah, Saudi Arabia. Company is working in Legal Services, Audit and Accounting, Business Management Consulting, Lawyers, Construction Services business activities.",,,https://arablocal.com/business/view/betterhomes,,,,,
accounting,Al Robaish Certified Accountants Office,+966 14922061,,,,"Khurais Road, Khurais Road, Khurais Road, Riyadh, Riyadh Province, Saudi Arabia",Khurais Road,Riyadh Province,Saudi Arabia,"Al Robaish Certified Accountants Office Is Located In Riyadh, Saudi Arabia. Company Is Working In Audit And Accounting Business Activities.",,,https://arablocal.com/business/view/al-robaish-certified-accountants-office,,,,,
accessory,Anwar Alzahraae For Apparel Est,+966 6477348,,,,"P.O. Box: 34020 , Jeddah, Makkah Province, Saudi Arabia",P.O. Box: 34020,Makkah Province,Saudi Arabia,"ANWAR AL-ZAHRAAE FOR APPAREL EST. is located in Jeddah, Saudi Arabia. Company is working in Clothing and Accessories, Kids, Baby Clothing, Kids Clothing business activities.",,,https://arablocal.com/business/view/anwar-alzahraae-for-apparel-est,,,,,
accessory,Basalamah Y Trading Corporation,+966 6425856,,,,"P.O.Box No : 18950 21425 , Jeddah, Makkah Province, Saudi Arabia",P.O.Box No : 18950 21425,Makkah Province,Saudi Arabia,"BASALAMAH, Y. TRADING CORP. is located in Jeddah, Saudi Arabia. Company is working in Clothing and Accessories, Shoes, Textile business activities.",,,https://arablocal.com/business/view/basalamah-y-trading-corporation,,,,,
accessory,Amaani Ali Omar Trading Est,+966 6896240,,,,"P.O. Box: 30015 , Jeddah, Makkah Province, Saudi Arabia",P.O. Box: 30015,Makkah Province,Saudi Arabia,"AMAANI ALI OMAR TRADING EST. is located in Jeddah, Saudi Arabia. Company is working in Kids, Baby Clothing, Kids Clothing business activities.",,,https://arablocal.com/business/view/amaani-ali-omar-trading-est,,,,,
accessory,Almaha Trading Est Jeddah,+966 6422774,,,,"P.O. Box: 32924 , Jeddah, Makkah Province, Saudi Arabia",P.O. Box: 32924,Makkah Province,Saudi Arabia,"AL-MAHA TRADING EST. is located in Jeddah, Saudi Arabia. Company is working in Kids, Baby Clothing, Kids Clothing business activities.",,,https://arablocal.com/business/view/almaha-trading-est-jeddah,,,,,
accomodation,Castle Porta - Cabins Factory,+966 560000773,,,,"Al Sulay Dist., Riyadh, Al Sulay Dist., Riyadh, Riyadh Province, Saudi Arabia",Al Sulay Dist.,Riyadh Province,Saudi Arabia,Castle Porta - Cabins Factory,,,https://arablocal.com/business/view/castle-porta-cabins-factory,,,,,
accessory,Ali Salim Al Awaini Trading Est,+966 14042756,,,,"Po Box 41167 11521 , Riyadh City, Riyadh, Riyadh Province, Saudi Arabia",Po Box 41167 11521,Riyadh Province,Saudi Arabia,"ALI SALIM AL AWAINI TRADING EST is located in Riyadh, Saudi Arabia. Company is working in Clothing and Accessories, Shoes business activities.",,,https://arablocal.com/business/view/ali-salim-al-awaini-trading-est,,,,,
accomodation,Platinum Express Hotel Suites,+966 126127676,,,,"Sulaimaniyah Dist., Jeddah, Sulaimaniyah Dist., Jeddah, Makkah Province, Saudi Arabia",Sulaimaniyah Dist.,Makkah Province,Saudi Arabia,Platinum Express Hotel Suites,,,https://arablocal.com/business/view/platinum-express-hotel-suites,,,,,
accounting,Abdullah Al Bayodh Certified Public Accountants,+966 38330245,,,,"Bareed Dist., Dammam, Eastern Province, Saudi Arabia",Bareed Dist.,Eastern Province,Saudi Arabia,"Abdullah Al Bayodh Certified Public Accountants Is Located In Dammam, Saudi Arabia. Company Is Working In Audit And Accounting Business Activities.",,,https://arablocal.com/business/view/abdullah-al-bayodh-certified-public-accountants,,,,,
accessory,Alrawaee Trading Est,+966 6440588,,,,"P.O. Box: 3913 , Jeddah, Makkah Province, Saudi Arabia",P.O. Box: 3913,Makkah Province,Saudi Arabia,"AL-RAWAEE TRADING EST. is located in Jeddah, Saudi Arabia. Company is working in Kids, Baby Clothing, Kids Clothing business activities.",,,https://arablocal.com/business/view/alrawaee-trading-est,,,,,
accounting,Abdullah Al Badran Office,+966 26693334,,,,"Rouwais, Rouwais Dist., Jeddah, Makkah Province, Saudi Arabia",Rouwais,Makkah Province,Saudi Arabia,"Abdullah Al Badran Office Is Located In Jeddah, Saudi Arabia. Company Is Working In Audit And Accounting Business Activities.",,,https://arablocal.com/business/view/abdullah-al-badran-office,,,,,
accounting,Al Dar Accounts Audting Riyadh,+966 14611995,+966 14630680,,,"Ulaya, Ulaya Dist., Riyadh, Riyadh Province, Saudi Arabia",Ulaya,Riyadh Province,Saudi Arabia,"Al Dar Accounts Audtin Is Located In Riyadh, Saudi Arabia. Company Is Working In Audit And Accounting Business Activities.",,,https://arablocal.com/business/view/al-dar-accounts-audting-riyadh,,,,,
accessory,Ali Mohd Zahrani Trading Est,+966 26321072,,,,"Saheefah Dist., Jeddah, Makkah Province, Saudi Arabia",Saheefah Dist.,Makkah Province,Saudi Arabia,"Ali Mohd Zahrani Trading Est. is located in Jeddah, Saudi Arabia. Company is working in Gifts, Accessories, Gift Shops business activities.",,,https://arablocal.com/business/view/ali-mohd-zahrani-trading-est,,,,,
accomodation,Ibrahim Alamaaoa And Partner Prefabricated Houses And Transportation,+966 138155257,,,,"Dhahran Jubail Highway, Dhahran, Dammam, Dhahran, Dammam, Eastern Province, Saudi Arabia",Dhahran Jubail Highway,Eastern Province,Saudi Arabia,Ibrahim Alamaaoa And Partner Prefabricated Houses And Transportation,,,https://arablocal.com/business/view/ibrahim-alamaaoa-and-partner-prefabricated-houses-and-transportation,,,,,
accounting,Abdul Razzaq Waly Sait Certified Accountant,+966 14776731,,,,"Riyadh City, Riyadh, Riyadh Province, Saudi Arabia",Riyadh City,Riyadh Province,Saudi Arabia,"Abdul Razzaq Waly Sait - Certified Accountant Is Located In Riyadh, Saudi Arabia. Company Is Working In Audit And Accounting Business Activities.",,,https://arablocal.com/business/view/abdul-razzaq-waly-sait--certified-accountant,,,,,
accounting,Arthur D Little International Co Ltd,,,,,"Po Box 3266 11471 , Riyadh City, Riyadh, Riyadh Province, Saudi Arabia",Po Box 3266 11471,Riyadh Province,Saudi Arabia,"ARTHUR D. LITTLE INTERNATIONAL CO.LTD. is located in Riyadh, Saudi Arabia. Company is working in Audit and Accounting business activities.",,,https://arablocal.com/business/view/arthur-d-little-international-co-ltd,,,,,
accessory,Busaiten Est For Trading,+966 14461733,,,,"P.O. Box: 21507 , Riyadh City, Riyadh, Riyadh Province, Saudi Arabia",P.O. Box: 21507,Riyadh Province,Saudi Arabia,"BUSAITEN EST FOR TRADING is located in Riyadh, Saudi Arabia. Company is working in Clothing and Accessories, Shoes business activities.",,,https://arablocal.com/business/view/busaiten-est-for-trading,,,,,
accomodation,Western Park,+966 133444435,,,,"Jubail, Jubail, Jubail, Eastern Province, Saudi Arabia",Jubail,Eastern Province,Saudi Arabia,Western Park,,,https://arablocal.com/business/view/western-park,,,,,
accessory,Azwaq Exhibition For Footwear,+966 14653833,,,,"Riyadh City, Riyadh, Riyadh Province, Saudi Arabia",Riyadh City,Riyadh Province,Saudi Arabia,"AZWAQ EXHIBITION FOR FOOTWEAR is located in Riyadh, Saudi Arabia. Company is working in Clothing and Accessories, Shoes business activities.",,,https://arablocal.com/business/view/azwaq-exhibition-for-footwear,,,,,
accomodation,Bin Hizam Est. For Mobile Houses,+966 126620015,,,,"Prince Sultan Street, Salama Dist., Jeddah, Salama Dist., Jeddah, Makkah Province, Saudi Arabia",Prince Sultan Street,Makkah Province,Saudi Arabia,Bin Hizam Est. For Mobile Houses,,,https://arablocal.com/business/view/bin-hizam-est-for-mobile-houses,,,,,
advertising-&-marketing-services,Pteam Advertising Agency,+966 557226628,,,info@pteam.sa,"Prince Mohammed Bin Abdulaziz Branch Rd Jeddah 23334, Saudi Arabia, Aziziyah Dist., Jeddah, Makkah Province, Saudi Arabia",Prince Mohammed Bin Abdulaziz Branch Rd Jeddah 23334,Makkah Province,Saudi Arabia,"Pteam Advertising Agency is a Saudi company that started working in advertising and marketing services in 2016 in providing gifts and promotional products services to private companies, government organizations and more. Our products are 100% manufactured inside Saudi Arabia with high quality, competitive prices with great service.",http://pteam.sa,,https://arablocal.com/business/view/pteam-advertising-agency,https://www.facebook.com/Pteam.sa,https://www.instagram.com/pteam_sa/,https://www.linkedin.com/company/pteam-sa/,https://twitter.com/Pteam_sa,
accessory,Ayesha F Abdulla Murtei Trading Est,+966 6486214,,,,"P.O. Box: 5003 , Jeddah, Makkah Province, Saudi Arabia",P.O. Box: 5003,Makkah Province,Saudi Arabia,"AYESHA F. ABDULLA MURTEI TRDG. EST. is located in Jeddah, Saudi Arabia. Company is working in Clothing and Accessories, Kids, Baby Clothing, Kids Clothing business activities.",,,https://arablocal.com/business/view/ayesha-f-abdulla-murtei-trading-est,,,,,
accomodation,Smart Home,+966 122611121,,,,"Tahlyah St., Jeddah, Tahlyah St., Jeddah, Makkah Province, Saudi Arabia",Tahlyah St.,Makkah Province,Saudi Arabia,,,,https://arablocal.com/business/view/smart-home,,,,,
accounting,Ahmed Alyahya Consultation Office,,,,,"Po Box 58774 11515, Riyadh City, Riyadh, Riyadh Province, Saudi Arabia",Po Box 58774 11515,Riyadh Province,Saudi Arabia,"Ahmed Alyahya Consultaion Office. Is Located In Riyadh, Saudi Arabia. Company Is Working In Audit And Accounting Business Activities.",,,https://arablocal.com/business/view/ahmed-alyahya-consultation-office,,,,,
accomodation,Al Howail For Hotel Aparments,+966 138357005,,,,"Al Hamra Dist., Dammam, Al Hamra Dist., Dammam, Eastern Province, Saudi Arabia",Al Hamra Dist.,Eastern Province,Saudi Arabia,Al Howail For Hotel Aparments,,,https://arablocal.com/business/view/al-howail-for-hotel-aparments,,,,,
accomodation,Al Saaed Hospitality For Hotel Suites,+966 148278518,,,,"Prince Abdul Majed Street, Al Madinah Al Munawarah, Prince Abdul Majed Street, Al Madinah Al Munawarah, Madinah Province, Saudi Arabia",Prince Abdul Majed Street,Madinah Province,Saudi Arabia,Al Saaed Hospitality For Hotel Suites,,,https://arablocal.com/business/view/al-saaed-hospitality-for-hotel-suites,,,,,
advertising-&-marketing-services,edirect,+966 112611594,,,info@edirect.sa,"Level 1, Building 7, Business Gate, Airport Road, Qurtubah, Riyadh 11683, Saudi Arabia, Qurtubah Dist., Riyadh, Riyadh Province, Saudi Arabia",Level 1,Riyadh Province,Saudi Arabia,"edirect is an Award-Winning Digital Marketing Agency in Saudi Arabia with over 22 years of excellence. We pride ourselves on delivering bespoke, fully optimised websites that elevate your online presence. Our journey began as a one-person division and has since evolved into a dynamic full-service agency. Today, edirect boasts a close-knit team of experts in interactive development, covering strategic, creative, and technical aspects. From Website Development in Riyadh to comprehensive Digital...",http://edirect.sa/,,https://arablocal.com/business/view/edirect--digital-marketing-agency-riyadh,https://www.facebook.com/edirectME/,https://www.instagram.com/edirectme/,https://www.linkedin.com/company/edirectme,https://twitter.com/edirectME,
accomodation,Golden Renad housing units,+966 148358999,,,,"Second Ring, Al Madinah Al Munawarah, Second Ring, Al Madinah Al Munawarah, Madinah Province, Saudi Arabia",Second Ring,Madinah Province,Saudi Arabia,Golden Renad housing units,,,https://arablocal.com/business/view/golden-renad-housing-units,,,,,
accessory,Alyaf Industrial Co Limited Dammam,+966 38121206,,,,"Po Box 10737; 31443 , Dammam, Eastern Province, Saudi Arabia",Po Box 10737; 31443,Eastern Province,Saudi Arabia,"ALYAF INDUSTRIAL CO LTD is located in Dammam, Saudi Arabia. Company is working in Clothing and Accessories, Textile business activities. Visit our company website for more information about us : http://alyaf.com If you have any questions, please contact us",,,https://arablocal.com/business/view/alyaf-industrial-co-limited-dammam,,,,,
accomodation,Royal Gulf Hotel,+966 584668680,,,,"King Saud Street, Uhud Dist., Dammam, Uhud Dist., Dammam, Eastern Province, Saudi Arabia",King Saud Street,Eastern Province,Saudi Arabia,Royal Gulf Hotel,,,https://arablocal.com/business/view/royal-gulf-hotel,,,,,
